video_url,title,description,length,length_in_minutes,views,upload_date,related_tags,translations,speaker_name,speaker_profession,orig
https://www.ted.com/talks/anote_tong_my_country_will_be_underwater_soon_unless_we_work_together,My country will be underwater soon — unless we work together,"For the people of Kiribati, climate change isn't something to be debated, denied or legislated against -- it's an everyday reality. The low-lying Pacific island nation may soon be underwater, thanks to rising sea levels. In a personal conversation with TED Curator Chris Anderson, Kiribati President Anote Tong discusses his country's present climate catastrophe and its imperiled future. ""In order to deal with climate change, there's got to be sacrifice. There's got to be commitment,"" he says. ""We've got to tell people that the world has changed.""",0:21:07,21.11666667,1140915,2015-11-18T15:46:48+00:00,"['global issues', 'oceans', 'mission blue', 'climate change', 'science', 'environment', 'humanity', 'policy', 'pollution', 'big problems', 'social change', 'fish', 'future', 'natural disaster']","['Deutsch', 'English', 'Español', 'Français', 'Italiano', 'Nederlands', 'Polski', 'Português brasileiro', 'Português de Portugal', 'Română', 'Slovenčina', 'Tiếng Việt', 'Türkçe', 'Ελληνικά', 'Русский', 'Српски, Srpski', 'עברית', 'العربية', 'فارسى', 'ภาษาไทย', '中文 (简体)', '中文 (繁體)', '日本語', '한국어']",Anote Tong,President of the Republic of Kiribati,middle
https://www.ted.com/talks/venus_keus_three_ways_the_universe_could_end,Three ways the universe could end,"We know about our universe's past: the Big Bang theory predicts that all matter, time and space began about 14 billion years ago. And we know about the present: scientists' observations of galaxies tell us that the universe is expanding at an accelerated rate. But what about the future? Do we know how our universe is going to end? Venus Keus explores cosmologists' three possible scenarios. [Directed by Antimatter Studio, narrated by Susan Zimmerman, music by André Aires AIM Creative Studios].",0:04:31,4.516666667,1149861,2019-02-19T19:49:19+00:00,"['TED-Ed', 'space', 'animation', 'science', 'physics', 'big bang', 'universe', 'solar system', 'Planets']","['Deutsch', 'English', 'Español', 'Français', 'Kiswahili', 'Magyar', 'Polski', 'Português brasileiro', 'Português de Portugal', 'Română', 'Suomi', 'Tiếng Việt', 'Türkçe', 'Русский', 'Српски, Srpski', 'Українська', 'български', 'עברית', 'العربية', 'فارسى', 'کوردی', 'ภาษาไทย', 'မြန်မာဘာသာ', '中文 (简体)', '中文 (繁體)', '日本語', '한국어']",Venus Keus,Educator,middle
https://www.ted.com/talks/gabby_giffords_and_mark_kelly_be_passionate_be_courageous_be_your_best,Be passionate. Be courageous. Be your best.,"On January 8, 2011, Congresswoman Gabby Giffords was shot in the head while meeting constituents in her home town of Tucson, Arizona. Her husband, the astronaut Mark Kelly, immediately flew to be by her side. In this emotional conversation with Pat Mitchell, the pair describe their lives both before and after the accident -- and describe their views on responsible gun ownership.",0:18:37,18.61666667,1139582,2014-04-11T15:24:09+00:00,"['violence', 'guns']","['English', 'Español', 'Français', 'Italiano', 'Magyar', 'Nederlands', 'Polski', 'Português brasileiro', 'Português de Portugal', 'Română', 'Tiếng Việt', 'Ελληνικά', 'Русский', 'Српски, Srpski', 'Українська', 'עברית', 'العربية', 'فارسى', 'ภาษาไทย', '中文 (简体)', '中文 (繁體)', '日本語', '한국어']",Gabby Giffords and Mark Kelly,Former U.S. Representative and NASA astronaut; survivors,middle
https://www.ted.com/talks/tania_simoncelli_should_you_be_able_to_patent_a_human_gene,Should you be able to patent a human gene?,"A decade ago, US law said human genes were patentable -- which meant patent holders had the right to stop anyone from sequencing, testing or even looking at a patented gene. Troubled by the way this law both harmed patients and created a barrier to biomedical innovation, Tania Simoncelli and her colleagues at the ACLU challenged it. In this riveting talk, hear the story of how they took a case everybody told them they would lose all the way to the Supreme Court.",0:17:58,17.96666667,1139432,2016-01-27T15:35:20+00:00,"['activism', 'biotech', 'genetics', 'cancer', 'Debate', 'government', 'health', 'law', 'health care', 'medical research', 'nature', 'medicine', 'policy', 'public health', 'society', 'science', 'technology', 'TEDx', 'innovation', 'pharmaceuticals']","['Deutsch', 'English', 'Español', 'Français', 'Galego', 'Italiano', 'Português brasileiro', 'Português de Portugal', 'Tiếng Việt', 'Türkçe', 'Čeština', 'Ελληνικά', 'Русский', 'Српски, Srpski', 'български', 'עברית', 'العربية', 'فارسى', 'ภาษาไทย', 'မြန်မာဘာသာ', '中文 (简体)', '中文 (繁體)', '日本語', '한국어']",Tania Simoncelli,Policy expert,middle
https://www.ted.com/talks/vikram_patel_mental_health_for_all_by_involving_all,Mental health for all by involving all,"Nearly 450 million people are affected by mental illness worldwide. In wealthy nations, just half receive appropriate care, but in developing countries, close to 90 percent go untreated because psychiatrists are in such short supply. Vikram Patel outlines a highly promising approach -- training members of communities to give mental health interventions, empowering ordinary people to care for others.",0:12:07,12.11666667,1137691,2012-09-11T15:00:45+00:00,"['depression', 'global issues', 'health', 'mental health', 'public health']","['Bahasa Indonesia', 'Deutsch', 'English', 'Español', 'Français', 'Galego', 'Hrvatski', 'Italiano', 'Nederlands', 'Polski', 'Português brasileiro', 'Português de Portugal', 'Română', 'Tiếng Việt', 'Türkçe', 'Ελληνικά', 'Русский', 'Српски, Srpski', 'Українська', 'македонски', 'עברית', 'العربية', 'فارسى', 'മലയാളം', '中文 (简体)', '中文 (繁體)', '日本語', '한국어']",Vikram Patel,Mental health care advocate,middle
https://www.ted.com/talks/wingham_rowan_a_new_kind_of_job_market,A new kind of job market,Plenty of people need jobs with very flexible hours -- but it's difficult for those people to connect with the employers who need them. Wingham Rowan is working on that. He explains how the same technology that powers modern financial markets can help employers book workers for slivers of time.,0:12:05,12.08333333,1136652,2013-01-28T16:14:00+00:00,"['business', 'global issues', 'technology', 'work']","['Català', 'Deutsch', 'English', 'Español', 'Français', 'Italiano', 'Nederlands', 'Polski', 'Português brasileiro', 'Português de Portugal', 'Română', 'Tiếng Việt', 'Türkçe', 'Ελληνικά', 'Русский', 'Српски, Srpski', 'Українська', 'български', 'עברית', 'العربية', '中文 (简体)', '中文 (繁體)', '日本語', '한국어']",Wingham Rowan,Policy entrepreneur,middle
https://www.ted.com/talks/amit_sood_every_piece_of_art_you_ve_ever_wanted_to_see_up_close_and_searchable,Every piece of art you've ever wanted to see — up close and searchable,"What does a cultural Big Bang look like? For Amit Sood, director of Google's Cultural Institute and Art Project, it's an online platform where anyone can explore the world's greatest collections of art and artifacts in vivid, lifelike detail. Join Sood and Google artist in residence Cyril Diagne in a mind-bending demo of experiments from the Cultural Institute and glimpse the exciting future of accessibility to arts and culture.",0:14:53,14.88333333,1136345,2016-06-07T15:01:43+00:00,"['beauty', 'big bang', 'collaboration', 'data', 'computers', 'machine learning', 'exploration', 'future', 'Google', 'innovation', 'history', 'Internet', 'library', 'museums', 'society', 'painting', 'technology', 'software', 'visualizations', 'world cultures', 'culture', 'art']","['English', 'Español', 'Français', 'Italiano', 'Latviešu', 'Magyar', 'Nederlands', 'Polski', 'Português brasileiro', 'Português de Portugal', 'Română', 'Suomi', 'Tiếng Việt', 'Türkçe', 'Русский', 'Српски, Srpski', 'עברית', 'العربية', 'فارسى', '中文 (简体)', '中文 (繁體)', '日本語', '한국어']",Amit Sood,Technologist,middle
https://www.ted.com/talks/eric_berlow_and_sean_gourley_mapping_ideas_worth_spreading,Mapping ideas worth spreading,"What do 24,000 ideas look like? Ecologist Eric Berlow and physicist Sean Gourley apply algorithms to the entire archive of TEDx Talks, taking us on a stimulating visual tour to show how ideas connect globally.",0:07:44,7.733333333,1135907,2013-09-18T15:01:34+00:00,"['TED Fellows', 'algorithm', 'complexity', 'data', 'technology']","['Afrikaans', 'Bahasa Indonesia', 'Dansk', 'Deutsch', 'English', 'Español', 'Français', 'Galego', 'Italiano', 'Magyar', 'Nederlands', 'Polski', 'Português brasileiro', 'Português de Portugal', 'Română', 'Shqip', 'Slovenčina', 'Tiếng Việt', 'Türkçe', 'Čeština', 'Ελληνικά', 'Русский', 'Српски, Srpski', 'македонски', 'עברית', 'العربية', 'فارسى', 'ภาษาไทย', '中文 (简体)', '中文 (繁體)', '日本語', '한국어']",Eric Berlow,Ecologist,middle
https://www.ted.com/talks/mohamad_jebara_this_company_pays_kids_to_do_their_math_homework,This company pays kids to do their math homework,"Mohamad Jebara loves mathematics -- but he's concerned that too many students grow up thinking that this beautiful, rewarding subject is difficult and boring. His company is experimenting with a bold idea: paying students for completing weekly math homework. He explores the ethics of this model and how it's helping students -- and why learning math is crucial in the era of fake news.",0:13:34,13.56666667,1136081,2018-02-08T15:46:57+00:00,"['education', 'math', 'statistics', 'teaching']","['English', 'Español', 'Français', 'Italiano', 'Polski', 'Português brasileiro', 'Türkçe', 'Русский', 'Српски, Srpski', 'Українська', 'العربية', 'فارسى', 'ภาษาไทย', '中文 (简体)', '中文 (繁體)', '日本語', '한국어']",Mohamad Jebara,Education entrepreneur,middle
https://www.ted.com/talks/azim_khamisa_and_ples_felix_what_comes_after_tragedy_forgiveness,What comes after tragedy? Forgiveness,"On one awful night in 1995, Ples Felix's 14-year-old grandson murdered Azim Khamisa's son in a gang initiation fueled by drugs, alcohol and a false sense of belonging. The deadly encounter sent Khamisa and Felix down paths of deep meditation, to forgive and to be forgiven -- and in an act of bravery and reconciliation, the two men met and forged a lasting bond. Together, they've used their story as an outline for a better, more merciful society, where victims of tragedy can grow and heal. Prepare to be moved by their unimaginable story. ""Peace is possible,"" Khamisa says. ""How do I know that? Because I am at peace.""",0:12:49,12.81666667,1135081,2018-01-19T20:46:15+00:00,"['activism', 'children', 'community', 'compassion', 'communication', 'empathy', 'social change', 'death', 'society', 'humanity', 'violence']","['English', 'Español', 'Français', 'Português brasileiro', 'Português de Portugal', 'Română', 'Tiếng Việt', 'Türkçe', 'Ελληνικά', 'Русский', 'Српски, Srpski', 'Українська', 'עברית', 'العربية', 'فارسى', 'हिन्दी', '中文 (简体)', '中文 (繁體)', '日本語', '한국어']",Azim Khamisa,"Author, peace activist",middle
https://www.ted.com/talks/will_potter_the_shocking_move_to_criminalize_nonviolent_protest,The shocking move to criminalize nonviolent protest,"In 2002, investigative journalist and TED Fellow Will Potter took a break from his regular beat, writing about shootings and murders for the Chicago Tribune. He went to help a local group campaigning against animal testing: ""I thought it would be a safe way to do something positive,"" he says. Instead, he was arrested, and so began his ongoing journey into a world in which peaceful protest is branded as terrorism.",0:04:21,4.35,1134354,2014-06-11T14:57:08+00:00,"['TED Fellows', 'activism', 'animals', 'environment', 'journalism', 'politics', 'terrorism', 'nonviolence']","['Bahasa Indonesia', 'Català', 'Dansk', 'Deutsch', 'English', 'Español', 'Français', 'Galego', 'Hrvatski', 'Italiano', 'Kiswahili', 'Nederlands', 'Polski', 'Português brasileiro', 'Português de Portugal', 'Română', 'Slovenčina', 'Tiếng Việt', 'Türkçe', 'Ελληνικά', 'Русский', 'Српски, Srpski', 'Українська', 'македонски', 'עברית', 'العربية', 'اُردُو', 'فارسى', 'हिन्दी', 'ภาษาไทย', 'မြန်မာဘာသာ', '中文 (简体)', '中文 (繁體)', '日本語', '한국어']",Will Potter,Investigative journalist,middle
https://www.ted.com/talks/john_amory_how_a_male_contraceptive_pill_could_work,How a male contraceptive pill could work,Andrologist John Amory is developing innovative male contraception that gives men a new option for taking responsibility to prevent unintended pregnancy. He details the science in development -- and why the world needs a male pill.,0:06:15,6.25,1134134,2018-05-01T19:59:51+00:00,"['biology', 'biotech', 'innovation', 'health', 'human body', 'medicine', 'public health', 'social change', 'science', 'society', 'TEDMED', 'sex']","['Bahasa Indonesia', 'Català', 'English', 'Español', 'Français', 'Galego', 'Italiano', 'Magyar', 'Polski', 'Português brasileiro', 'Português de Portugal', 'Svenska', 'Tiếng Việt', 'Türkçe', 'Ελληνικά', 'Русский', 'Українська', 'العربية', 'فارسى', 'မြန်မာဘာသာ', '中文 (简体)', '中文 (繁體)', '日本語', '한국어']",John Amory,Male reproductive health expert,middle
https://www.ted.com/talks/david_gallo_life_in_the_deep_oceans,Life in the deep oceans,"With vibrant video clips captured by submarines, David Gallo takes us to some of Earth's darkest, most violent, toxic and beautiful habitats, the valleys and volcanic ridges of the oceans' depths, where life is bizarre, resilient and shockingly abundant.",0:13:08,13.13333333,1133802,2008-09-11T01:00:00+00:00,"['animals', 'geology', 'life', 'oceans', 'science', 'submarine', 'technology', 'marine biology']","['Deutsch', 'English', 'Español', 'Français', 'Hrvatski', 'Italiano', 'Magyar', 'Nederlands', 'Polski', 'Português brasileiro', 'Português de Portugal', 'Română', 'Slovenčina', 'Tiếng Việt', 'Türkçe', 'Čeština', 'Ελληνικά', 'Русский', 'Српски, Srpski', 'български', 'עברית', 'العربية', '中文 (简体)', '中文 (繁體)', '日本語', '한국어']",David Gallo,Oceanographer,middle
https://www.ted.com/talks/charity_wayua_a_few_ways_to_fix_a_government,A few ways to fix a government,"Charity Wayua put her skills as a cancer researcher to use on an unlikely patient: the government of her native Kenya. She shares how she helped her government drastically improve its process for opening up new businesses, a crucial part of economic health and growth, leading to new investments and a World Bank recognition as a top reformer.",0:11:43,11.71666667,1132918,2017-02-23T15:49:58+00:00,"['Africa', 'business', 'communication', 'collaboration', 'cancer', 'economics', 'global development', 'goal-setting', 'health', 'innovation', 'investment', 'potential', 'society', 'government']","['English', 'Español', 'Français', 'Hrvatski', 'Italiano', 'Kiswahili', 'Magyar', 'Polski', 'Português brasileiro', 'Português de Portugal', 'Slovenčina', 'Tiếng Việt', 'Türkçe', 'Ελληνικά', 'Русский', 'Српски, Srpski', 'العربية', 'فارسى', 'کوردی', 'हिन्दी', 'ภาษาไทย', 'မြန်မာဘာသာ', 'ქართული', '中文 (简体)', '中文 (繁體)', '日本語', '한국어']",Charity Wayua,Public sector researcher,middle
https://www.ted.com/talks/chris_mcknett_the_investment_logic_for_sustainability,The investment logic for sustainability,"Sustainability is pretty clearly one of the world's most important goals; but what groups can really make environmental progress in leaps and bounds? Chris McKnett makes the case that it's large institutional investors. He shows how strong financial data isn't enough, and reveals why investors need to look at a company's environmental, social and governance structures, too.",0:12:07,12.11666667,1133228,2014-02-12T16:06:59+00:00,"['business', 'finance', 'investment', 'sustainability']","['Dansk', 'Deutsch', 'English', 'Español', 'Français', 'Italiano', 'Latviešu', 'Lietuvių kalba', 'Polski', 'Português brasileiro', 'Português de Portugal', 'Română', 'Tiếng Việt', 'Türkçe', 'Ελληνικά', 'Русский', 'Српски, Srpski', 'Українська', 'български', 'עברית', 'العربية', 'فارسى', '中文 (简体)', '中文 (繁體)', '日本語', '한국어']",Chris McKnett,Sustainable investment champion,middle
https://www.ted.com/talks/richard_seymour_how_beauty_feels,How beauty feels,"A story, a work of art, a face, a designed object -- how do we tell that something is beautiful? And why does it matter so much to us? Designer Richard Seymour explores our response to beauty and the surprising power of objects that exhibit it.",0:17:00,17,1132998,2011-10-11T15:12:48+00:00,"['Senses', 'beauty', 'design', 'happiness', 'art']","['Bahasa Indonesia', 'Dansk', 'Deutsch', 'English', 'Español', 'Français', 'Italiano', 'Magyar', 'Nederlands', 'Norsk bokmål', 'Polski', 'Português brasileiro', 'Português de Portugal', 'Română', 'Shqip', 'Tiếng Việt', 'Türkçe', 'Čeština', 'Ελληνικά', 'Русский', 'Српски, Srpski', 'Українська', 'български', 'עברית', 'العربية', 'فارسى', 'ภาษาไทย', '中文 (简体)', '中文 (繁體)', '日本語', '한국어']",Richard Seymour,Designer,middle
https://www.ted.com/talks/wael_ghonim_inside_the_egyptian_revolution,Inside the Egyptian revolution,"Wael Ghonim is the Google executive who helped jumpstart Egypt's democratic revolution ... with a Facebook page memorializing a victim of the regime's violence. Speaking at TEDxCairo, he tells the inside story of the past two months, when everyday Egyptians showed that ""the power of the people is stronger than the people in power.""",0:09:52,9.866666667,1132962,2011-03-04T19:59:00+00:00,"['Egypt', 'democracy', 'global issues', 'politics', 'protests', 'social change']","['Bahasa Indonesia', 'Deutsch', 'English', 'Español', 'Français', 'Hrvatski', 'Italiano', 'Magyar', 'Nederlands', 'Polski', 'Português brasileiro', 'Português de Portugal', 'Română', 'Shqip', 'Slovenčina', 'Svenska', 'Tiếng Việt', 'Türkçe', 'Ελληνικά', 'Русский', 'Српски, Srpski', 'български', 'Հայրեն', 'עברית', 'العربية', 'فارسى', 'हिन्दी', 'සිංහල', '中文 (简体)', '中文 (繁體)', '日本語', '한국어']",Wael Ghonim,Internet activist and computer engineer,middle
https://www.ted.com/talks/courtney_e_martin_this_isn_t_her_mother_s_feminism,This isn't her mother's feminism,"Blogger Courtney E. Martin examines the perennially loaded word ""feminism"" in this personal and heartfelt talk. She talks through the three essential paradoxes of her generation's quest to define the term for themselves.",0:11:12,11.2,1130764,2011-03-08T16:24:00+00:00,"['culture', 'feminism', 'history', 'identity', 'women', 'writing']","['Bahasa Indonesia', 'Deutsch', 'English', 'Español', 'Français', 'Hrvatski', 'Italiano', 'Magyar', 'Nederlands', 'Polski', 'Português brasileiro', 'Português de Portugal', 'Română', 'Slovenčina', 'Tiếng Việt', 'Türkçe', 'Ελληνικά', 'Русский', 'Српски, Srpski', 'Українська', 'български', 'עברית', 'العربية', 'فارسى', 'ภาษาไทย', '中文 (简体)', '中文 (繁體)', '日本語', '한국어']",Courtney E. Martin,Journalist,middle
https://www.ted.com/talks/gary_greenberg_the_beautiful_nano_details_of_our_world,The beautiful nano details of our world,"When photographed under a 3D microscope, grains of sand appear like colorful pieces of candy and the stamens in a flower become like fantastical spires at an amusement park. Gary Greenberg reveals the thrilling details of the micro world.",0:11:51,11.85,1130044,2012-11-07T16:01:38+00:00,"['TEDx', 'bees', 'nature', 'photography']","['Deutsch', 'English', 'Español', 'Français', 'Italiano', 'Nederlands', 'Polski', 'Português brasileiro', 'Português de Portugal', 'Română', 'Tiếng Việt', 'Türkçe', 'Čeština', 'Русский', 'Српски, Srpski', 'Українська', 'עברית', 'العربية', 'کوردی', 'ภาษาไทย', '中文 (简体)', '中文 (繁體)', '日本語', '한국어']",Gary Greenberg,Micro photographer,middle
https://www.ted.com/talks/salil_dudani_how_jails_extort_the_poor,How jails extort the poor,"Why do we jail people for being poor? Today, half a million Americans are in jail only because they can't afford to post bail, and still more are locked up because they can't pay their debt to the court, sometimes for things as minor as unpaid parking tickets. Salil Dudani shares stories from individuals who have experienced debtors' prison in Ferguson, Missouri, challenging us to think differently about how we punish the poor and marginalized.",0:12:35,12.58333333,1130207,2017-02-16T16:05:36+00:00,"['corruption', 'activism', 'government', 'crime', 'prison', 'poverty', 'terrorism', 'TEDx', 'criminal justice', 'justice system']","['Català', 'Deutsch', 'English', 'Español', 'Français', 'Italiano', 'Magyar', 'Português brasileiro', 'Português de Portugal', 'Română', 'Tiếng Việt', 'Türkçe', 'Русский', 'Українська', 'العربية', 'मराठी', 'ภาษาไทย', '中文 (简体)', '中文 (繁體)', '日本語', '한국어']",Salil Dudani,Legal activist,middle
https://www.ted.com/talks/samantha_nutt_the_real_harm_of_the_global_arms_trade,The real harm of the global arms trade,"In some parts of the world, it's easier to get an automatic rifle than a glass of clean drinking water. Is this just the way it is? Samantha Nutt, doctor and founder of the international humanitarian organization War Child, explores the global arms trade -- and suggests a bold, common sense solution for ending the cycle of violence. ""War is ours,"" she says. ""We buy it, sell it, spread it and wage it. We are therefore not powerless to solve it.""",0:13:27,13.45,1127820,2016-06-01T15:10:18+00:00,"['activism', 'Africa', 'big problems', 'business', 'children', 'community', 'death', 'economics', 'guns', 'global issues', 'inequality', 'humanity', 'security', 'society', 'war', 'violence']","['Bahasa Indonesia', 'Deutsch', 'English', 'Español', 'Français', 'Italiano', 'Magyar', 'Nederlands', 'Polski', 'Português brasileiro', 'Português de Portugal', 'Română', 'Tiếng Việt', 'Türkçe', 'Ελληνικά', 'Русский', 'Українська', 'עברית', 'العربية', '中文 (简体)', '中文 (繁體)', '日本語', '한국어']",Samantha Nutt,"Doctor, writer and humanitarian",middle
https://www.ted.com/talks/natalie_panek_let_s_clean_up_the_space_junk_orbiting_earth,Let's clean up the space junk orbiting Earth,"Our lives depend on a world we can't see: the satellite infrastructure we use every day for information, entertainment, communication and so much more. But Earth orbit isn't a limitless resource, and the problem of space debris will get worse without a significant change to our behavior. Natalie Panek challenges us to consider the environmental impact of the satellites we rely on. Our orbital environment is breathtakingly beautiful and our gateway to exploration, she says. It's up to us to keep it that way.",0:10:00,10,1127495,2016-12-06T16:27:30+00:00,"['communication', 'engineering', 'environment', 'rocket science', 'exploration', 'science', 'technology', 'TEDx']","['Deutsch', 'English', 'Español', 'Français', 'Italiano', 'Magyar', 'Nederlands', 'Polski', 'Português brasileiro', 'Português de Portugal', 'Română', 'Svenska', 'Tiếng Việt', 'Türkçe', 'Čeština', 'Ελληνικά', 'Русский', 'Српски, Srpski', 'Українська', 'עברית', 'العربية', 'فارسى', 'ภาษาไทย', '中文 (简体)', '中文 (繁體)', '日本語', '한국어']",Natalie Panek,"Rocket scientist, explorer",middle
