video_url,title,description,length,length_in_minutes,views,upload_date,related_tags,translations,speaker_name,speaker_profession
https://www.ted.com/talks/riche_d_richardson_the_hidden_life_of_rosa_parks,The hidden life of Rosa Parks,"Throughout her life, Rosa Parks repeatedly challenged racial violence and the prejudiced systems protecting its perpetrators. Her refusal to move to the back of a segregated bus ignited a boycott that lasted 381 days and helped transform civil rights activism into a national movement. But this work came at an enormous risk— and a personal price. Riché D. Richardson details the life of Rosa Parks. [Directed by Eido, narrated by Christina Greer, music by John Poon].",00:04:40,4.666666666666667,288314,2020-04-13T16:10:22+00:00,"['TED-Ed', 'animation', 'education', 'feminism', 'women', 'race', 'history', 'activism', 'United States']","['English', 'Español', 'Français', 'Hrvatski', 'Italiano', 'Magyar', 'Português brasileiro', 'Português de Portugal', 'Română', 'Suomi', 'Türkçe', 'Русский', 'Српски, Srpski', 'العربية', 'فارسى', 'کوردی', 'မြန်မာဘာသာ', '中文 (简体)', '中文 (繁體)', '日本語']",Riché Richardson,Educator
https://www.ted.com/talks/alejandro_duran_how_i_use_art_to_tackle_plastic_pollution_in_our_oceans,How I use art to tackle plastic pollution in our oceans,"Alejandro Durán uses art to spotlight the ongoing destruction of our oceans' ecosystems. In this breathtaking talk, he shows how he meticulously organizes and reuses plastic waste from around the world that washes up on the Caribbean coast of Mexico -- everything from water bottles to prosthetic legs -- to create vivid, environmental artworks that may leave you mesmerized and shocked.",00:07:09,7.15,283862,2019-12-02T15:54:42+00:00,"['art', 'pollution', 'creativity', 'culture', 'oceans', 'climate change', 'community']","['Bahasa Indonesia', 'English', 'Español', 'Français', 'Italiano', 'Magyar', 'Português brasileiro', 'Português de Portugal', 'Română', 'Türkçe', 'Русский', 'Українська', 'български', 'македонски', 'العربية', 'کوردی', 'हिन्दी', 'မြန်မာဘာသာ', '中文 (简体)', '中文 (繁體)', '日本語', '한국어']",Alejandro Durán,Multimedia artist
https://www.ted.com/talks/iseult_gillespie_why_should_you_read_midnight_s_children,"Why should you read ""Midnight's Children""?","It begins with a countdown. A woman goes into labor as the clock ticks towards midnight. Across India, people wait for the declaration of independence after nearly 200 years of British rule. At the stroke of midnight, an infant and two new nations are born in perfect synchronicity. These events form the foundation of ""Midnight's Children."" Iseult Gillespie explores Salman Rushdie's dazzling novel. [Directed by Tomás Pichardo-Espaillat, narrated by Adrian Dannatt, music by Cem Misirlioglu / Joel Kreimeyer-Kelly].",00:05:43,5.716666666666667,282566,2019-09-10T19:04:50+00:00,"['TED-Ed', 'india', 'animation', 'history', 'book', 'magic', 'books', 'writing', 'novel', 'literature']","['English', 'Español', 'Français', 'Italiano', 'Magyar', 'Português brasileiro', 'Português de Portugal', 'Română', 'Tiếng Việt', 'Türkçe', 'Русский', 'العربية', 'فارسى', 'မြန်မာဘာသာ', '中文 (简体)', '中文 (繁體)', '日本語']",Iseult Gillespie,Educator
https://www.ted.com/talks/ming_luke_what_s_the_point_e_of_ballet,What's the point(e) of ballet?,"A baby cursed at birth. A fierce battle of good and evil. A true love awoken with a kiss. Since premiering in 1890, ""The Sleeping Beauty"" has become one of the most frequently staged ballets in history. So what makes this piece so beloved? And what exactly does ballet bring to this— or any other— story? Ming Luke shares what makes ballet the perfect medium for stories old and new. [Directed by Visorama, narrated by Addison Anderson, music by Jarrett Farkas].",00:04:40,4.666666666666667,282884,2020-04-20T15:16:42+00:00,"['TED-Ed', 'education', 'animation', 'dance', 'history', 'arts', 'music']","['English', 'Español', 'Français', 'Hrvatski', 'Magyar', 'Português brasileiro', 'Português de Portugal', 'Română', 'Türkçe', 'Українська', 'العربية', 'کوردی', '中文 (简体)', '中文 (繁體)', '日本語', '한국어']",Ming Luke,Educator
https://www.ted.com/talks/bilal_bomani_plant_fuels_that_could_power_a_jet,Plant fuels that could power a jet,"Algae plus salt water equals ... fuel? At TEDxNASA@SiliconValley, Bilal Bomani reveals a self-sustaining ecosystem that produces biofuels -- without wasting arable land or fresh water.",00:14:19,14.316666666666666,279609,2012-01-21T14:58:26+00:00,"['TEDx', 'science', 'sustainability', 'technology', 'green', 'engineering', 'alternative energy', 'energy', 'biotech', 'environment', 'innovation', 'future', 'climate change', 'oceans', 'ecology', 'nature', 'solar energy', 'plants', 'synthetic biology', 'natural resources']","['English', 'Español', 'Français', 'Italiano', 'Português brasileiro', 'Português de Portugal', 'Română', 'Svenska', 'Tiếng Việt', 'Türkçe', 'Ελληνικά', 'Русский', 'Српски, Srpski', 'עברית', 'العربية', 'فارسى', '中文 (简体)', '中文 (繁體)', '日本語', '한국어']",Bilal Bomani,NASA scientist
https://www.ted.com/talks/ellen_agler_parasitic_worms_hold_back_human_progress_here_s_how_we_can_end_them,Parasitic worms hold back human progress. Here's how we can end them,"Parasitic worms date back thousands of years, causing diseases that limit human potential. But today, effective treatment against them requires just a few pills, taken once or twice a year. With 1.7 billion people at risk of infection, Ellen Agler and her team at the END Fund are imagining a world without disease caused by worms. Learn about how they're seeking to lower treatment costs, amplify prevention, support governments and nurture local leadership. This ambitious plan is a part of The Audacious Project, TED's initiative to inspire and fund global change. (Voiced by Ama Adi-Dako)",00:04:41,4.683333333333334,280988,2020-01-30T16:12:46+00:00,"['disease', 'Africa', 'humanity', 'future', 'Audacious Project', 'big problems', 'health', 'illness', 'public health']","['Català', 'Deutsch', 'English', 'Español', 'Français', 'Italiano', 'Kiswahili', 'Lietuvių kalba', 'Magyar', 'Português brasileiro', 'Português de Portugal', 'Română', 'Tiếng Việt', 'Türkçe', 'Ελληνικά', 'Русский', 'Українська', 'български', 'עברית', 'العربية', 'فارسى', 'کوردی', 'ภาษาไทย', '中文 (简体)', '中文 (繁體)', '日本語', '한국어']",Ellen Agler,Global health activist
https://www.ted.com/talks/mitchell_besser_mothers_helping_mothers_fight_hiv,Mothers helping mothers fight HIV,"In sub-Saharan Africa, HIV infections are more prevalent and doctors scarcer than anywhere else in the world. With a lack of medical professionals, Mitchell Besser enlisted the help of his patients to create mothers2mothers -- an extraordinary network of HIV-positive women whose support for each other is changing and saving lives.",00:18:15,18.25,279343,2010-09-22T08:54:00+00:00,"['AIDS', 'Africa', 'community', 'health', 'health care', 'women', 'HIV']","['Deutsch', 'English', 'Español', 'Français', 'Italiano', 'Nederlands', 'Polski', 'Português brasileiro', 'Português de Portugal', 'Română', 'Tiếng Việt', 'Türkçe', 'Русский', 'Српски, Srpski', 'български', 'עברית', 'العربية', '中文 (简体)', '中文 (繁體)', '日本語', '한국어']",Mitchell Besser,HIV/AIDS fighter
https://www.ted.com/talks/anika_hazra_a_simple_way_to_tell_insects_apart,A simple way to tell insects apart,"There are nearly a million known insect species in the world, but most have one of just five common types of mouthparts. Why is this information useful to scientists? Anika Hazra explains how the features of an insect's mouthparts can help identify which order it belongs to, while also providing clues about how it evolved and what it feeds on.",00:04:07,4.116666666666666,276254,2018-04-03T14:10:09+00:00,"['TED-Ed', 'animals', 'nature', 'insects', 'biology']","['Bahasa Indonesia', 'Deutsch', 'English', 'Español', 'Français', 'Italiano', 'Magyar', 'Português brasileiro', 'Português de Portugal', 'Tiếng Việt', 'Türkçe', 'Русский', 'Українська', 'עברית', 'العربية', 'हिन्दी', 'ภาษาไทย', '中文 (简体)', '中文 (繁體)', '日本語', '한국어']",Anika Hazra,Educator
https://www.ted.com/talks/rayma_suprani_dictators_hate_political_cartoons_so_i_keep_drawing_them,Dictators hate political cartoons — so I keep drawing them,"""A political cartoon is a barometer of freedom,"" says Rayma Suprani, who was exiled from her native Venezuela for publishing work critical of the government. ""That's why dictators hate cartoonists."" In a talk illustrated with highlights from a career spent railing against totalitarianism, Suprani explores how cartoons hold a mirror to society and reveal hidden truths -- and discusses why she keeps drawing even when it comes at a high personal cost. (In Spanish with consecutive English translation)",00:16:35,16.583333333333332,277257,2020-01-31T16:15:37+00:00,"['creativity', 'democracy', 'art', 'humor', 'journalism', 'immigration', 'news', 'media']","['Deutsch', 'English', 'Español', 'Français', 'Italiano', 'Magyar', 'Nederlands', 'Português brasileiro', 'Português de Portugal', 'Türkçe', 'Русский', 'العربية', '中文 (简体)', '中文 (繁體)', '한국어']",Rayma Suprani,Political cartoonist
https://www.ted.com/talks/rahaf_harfoush_how_burnout_makes_us_less_creative,How burnout makes us less creative,"Our obsession with productivity -- to-do lists, life hacks, morning routines -- is making us less productive, says digital anthropologist Rahaf Harfoush. She explains why we need to redesign our workday around creativity -- not just efficiency.",00:04:51,4.85,278574,2020-02-10T13:41:31+00:00,"['business', 'creativity', 'work']","['English', 'Español', 'Français', 'Português brasileiro', 'Tiếng Việt', 'Türkçe', 'العربية', 'فارسى', 'မြန်မာဘာသာ', '中文 (简体)', '中文 (繁體)', '日本語']",Rahaf Harfoush,Digital anthropologist
https://www.ted.com/talks/alex_rosenthal_the_gauntlet_think_like_a_coder_ep_8,"The Gauntlet | Think Like A Coder, Ep 8","This is episode 8 of our animated series ""Think Like A Coder."" This 10-episode narrative follows a girl, Ethic, and her robot companion, Hedge, as they attempt to save the world. The two embark on a quest to collect three artifacts and must solve their way through a series of programming puzzles. [Directed by Kozmonot Animation Studio, narrated by Addison Anderson].",00:08:02,8.033333333333333,275757,2020-04-16T19:37:40+00:00,"['TED-Ed', 'education', 'programming', 'animation', 'code', 'engineering', 'computers', 'math', 'Internet', 'technology']","['English', 'Español', 'Français', 'Italiano', 'Português brasileiro', 'Português de Portugal', 'Türkçe', 'Русский', 'العربية', '中文 (繁體)', '日本語']",Alex Rosenthal,Producer
https://www.ted.com/talks/seyi_oyesola_a_hospital_tour_in_nigeria,A hospital tour in Nigeria,Dr. Seyi Oyesola takes a searing look at health care in underdeveloped countries. His photo tour of a Nigerian teaching hospital -- all low-tech hacks and donated supplies -- drives home the challenge of doing basic health care there.,00:14:11,14.183333333333334,269951,2008-05-27T15:28:00+00:00,"['activism', 'design', 'health', 'health care', 'invention', 'public health', 'technology']","['Deutsch', 'English', 'Español', 'Français', 'Galego', 'Italiano', 'Magyar', 'Nederlands', 'Polski', 'Português brasileiro', 'Română', 'Tiếng Việt', 'Türkçe', 'Русский', 'български', 'עברית', 'العربية', '中文 (简体)', '中文 (繁體)', '日本語', '한국어']",Seyi Oyesola,Doctor
https://www.ted.com/talks/franco_sacchi_a_tour_of_nollywood_nigeria_s_booming_film_industry,"A tour of Nollywood, Nigeria's booming film industry","Zambia-born filmmaker Franco Sacchi tours us through Nollywood, Nigeria's booming film industry (the world's 3rd largest). Guerrilla filmmaking and brilliance under pressure from crews that can shoot a full-length feature in a week.",00:17:07,17.116666666666667,269203,2008-11-19T01:00:00+00:00,"['Africa', 'creativity', 'culture', 'entertainment', 'film', 'global issues', 'media', 'technology', 'movies']","['Deutsch', 'English', 'Español', 'Français', 'Nederlands', 'Polski', 'Português brasileiro', 'Română', 'Tiếng Việt', 'Türkçe', 'Русский', 'български', 'עברית', 'العربية', '中文 (简体)', '中文 (繁體)', '日本語', '한국어']",Franco Sacchi,Filmmaker
https://www.ted.com/talks/jon_gray_the_power_of_the_afro_pick,The power of the Afro pick,"The Afro pick is much more than a styling tool. It's a major player in Black history, explains artist Jon Gray.",00:03:34,3.5666666666666664,272228,2020-02-17T20:21:22+00:00,"['design', 'history', 'culture', 'creativity', 'social change']","['English', 'Español', 'Français', 'Português brasileiro', 'Tiếng Việt', 'Türkçe', 'العربية', 'کوردی', '中文 (简体)', '한국어']",Jon Gray,"Food enthusiast, dishwasher"
https://www.ted.com/talks/ike_ude_the_radical_beauty_of_africa_in_portraits,"The radical beauty of Africa, in portraits","Throughout his colorful career and bodies of work, Iké Udé has found creative ways to reject the negative portrayal of Africans rampant in Western media. In this tour of his work, he shares evocative portraits that blend clothing, props and poses from many cultures at once into sharp takes on the varied, complex beauty of Africa.",00:13:15,13.25,268239,2018-03-12T14:33:38+00:00,"['Africa', 'art', 'beauty', 'creativity', 'photography', 'identity', 'personal growth', 'social change']","['English', 'Español', 'Français', 'Italiano', 'Português brasileiro', 'Português de Portugal', 'Türkçe', 'Русский', 'العربية', 'فارسى', '中文 (简体)', '中文 (繁體)', '日本語', '한국어']",Iké Udé,Artist
https://www.ted.com/talks/ilan_stavans_infinity_according_to_jorge_luis_borges,Infinity according to Jorge Luis Borges,"What would it be like to have a limitless memory? Can the meaning of life be found in an infinite library? Is time a labyrinth or a single moment? Jorge Luis Borges explored these questions of infinity in his many works. His body of essays, poems and stories pioneered the literary style known as magical realism— and each was just a few pages long. Ilan Stavans dives into the world of Borges. [Directed by Aim Creative Studios, narrated by Ilan Stavans, music by Aim Creative Studios & André Aires].",00:04:32,4.533333333333333,268230,2019-07-16T12:54:14+00:00,"['animation', 'novel', 'Latin America', 'TED-Ed', 'books', 'writing', 'book', 'language', 'poetry', 'math', 'literature', 'memory', 'library', 'magic', 'time', 'science fiction']","['Bahasa Indonesia', 'Deutsch', 'English', 'Español', 'Français', 'Hrvatski', 'Italiano', 'Magyar', 'Português brasileiro', 'Português de Portugal', 'Română', 'Türkçe', 'Ελληνικά', 'Русский', 'Српски, Srpski', 'עברית', 'العربية', 'فارسى', 'မြန်မာဘာသာ', '中文 (简体)', '中文 (繁體)', '日本語', '한국어']",Ilan Stavans,Educator
https://www.ted.com/talks/nora_brown_east_virginia_john_brown_s_dream,"""East Virginia"" / ""John Brown's Dream""","In a mesmerizing set, musician Nora Brown breathes new life into two old-time banjo tunes: ""East Virginia"" and ""John Brown's Dream."" An evocative performance paired with a quick history of the banjo's evolution.",00:09:03,9.05,267453,2019-03-29T12:43:36+00:00,"['music', 'live music', 'vocals', 'performance', 'history']","['English', 'Español', 'Français', 'Italiano', 'Português brasileiro', 'Português de Portugal', 'Română', 'Türkçe', 'Українська', 'العربية', 'فارسى', 'کوردی', 'မြန်မာဘာသာ', '中文 (简体)', '中文 (繁體)', '한국어']",Nora Brown,Musician
https://www.ted.com/talks/sophie_zadeh_are_there_universal_expressions_of_emotion,Are there universal expressions of emotion?,The 40 or so muscles in the human face can be activated in different combinations to create thousands of expressions. But do these expressions look the same and communicate the same meaning around the world regardless of culture? Is one person's smile another's grimace? Sophie Zadeh investigates. [TED-Ed Animation by Estúdio Bacuri],00:04:45,4.75,267011,2018-07-09T14:03:45+00:00,"['TED-Ed', 'emotions', 'psychology']","['Bahasa Indonesia', 'Deutsch', 'English', 'Español', 'Français', 'Italiano', 'Magyar', 'Polski', 'Português brasileiro', 'Português de Portugal', 'Română', 'Tiếng Việt', 'Türkçe', 'Ελληνικά', 'Русский', 'Српски, Srpski', 'עברית', 'العربية', 'فارسى', 'ภาษาไทย', '中文 (简体)', '中文 (繁體)', '日本語', '한국어']",Sophie Zadeh,Educator
https://www.ted.com/talks/alex_rosenthal_the_chasm_think_like_a_coder_ep_6,"The Chasm | Think Like A Coder, Ep 6","This is episode 6 of our animated series ""Think Like A Coder."" This 10-episode narrative follows a girl, Ethic, and her robot companion, Hedge, as they attempt to save the world. The two embark on a quest to collect three artifacts and must solve their way through a series of programming puzzles. [Directed by Kozmonot Animation Studio, narrated by Addison Anderson].",00:06:25,6.416666666666667,268209,2020-01-30T16:41:13+00:00,"['animation', 'TED-Ed', 'code', 'computers', 'education', 'programming', 'Internet', 'math']","['English', 'Español', 'Français', 'Português brasileiro', 'Português de Portugal', 'Türkçe', 'Русский', 'العربية', 'မြန်မာဘာသာ', '中文 (简体)', '中文 (繁體)', '日本語']",Alex Rosenthal,Producer
https://www.ted.com/talks/philip_freeman_the_rise_and_fall_of_the_celtic_warriors,The rise and fall of the Celtic warriors,"One summer evening in 335 BCE, Alexander the Great was resting by the Danube River when a band of strangers approached his camp. Alexander had never seen anything like these tall, fierce-looking warriors with huge golden neck rings and colorful cloaks. They were Keltoi or Celts— a collection of independent tribes spread across Europe. Philip Freeman details the rise and fall of the ancient Celts. [Directed by Paper Panther, narrated by Addison Anderson, music by Stephen LaRosa].",00:04:52,4.866666666666667,289590,2020-07-21T14:32:28+00:00,"['TED-Ed', 'animation', 'education', 'history', 'war', 'religion', 'world cultures', 'culture', 'art', 'poetry']","['English', 'Magyar', 'Português brasileiro', 'Ελληνικά', '中文 (繁體)']",Philip Freeman,Educator
https://www.ted.com/talks/paul_lewis_how_mobile_phones_helped_solve_two_murders,How mobile phones helped solve two murders,"Two murders sat unexplained and unsolved -- until reporter Paul Lewis starting talking to bystanders who had evidence on their mobile phones. Step by step, Lewis pieced together their evidence and their stories to find justice for the victims. It's the future of investigative journalism, powered by the crowd.",00:16:45,16.75,264199,2011-11-05T13:57:49+00:00,"['TEDx', 'cities', 'collaboration', 'culture', 'global issues', 'journalism', 'social media']","['English', 'Español', 'Français', 'Italiano', 'Magyar', 'Português brasileiro', 'Português de Portugal', 'Русский', 'Српски, Srpski', 'Українська', 'العربية', 'فارسى', 'ภาษาไทย', '中文 (简体)', '中文 (繁體)', '日本語', '한국어']",Paul Lewis,Journalist
https://www.ted.com/talks/debbie_millman_the_function_and_fashion_of_eyeglasses,The function and fashion of eyeglasses,"Glasses were originally created to overcome physical obstacles, but design evangelist Debbie Millman shares how they turned into a fashion statement.",00:03:16,3.2666666666666666,266304,2020-02-17T20:20:59+00:00,"['design', 'fashion', 'sight', 'creativity']","['English', 'Español', 'Français', 'Magyar', 'Português brasileiro', 'Tiếng Việt', 'Türkçe', 'Русский', 'العربية', 'فارسى', 'کوردی', 'မြန်မာဘာသာ', '中文 (简体)', '中文 (繁體)']",Debbie Millman,Design evangelist
https://www.ted.com/talks/daniel_pauly_the_ocean_s_shifting_baseline,The ocean's shifting baseline,"The ocean has degraded within our lifetimes, as shown in the decreasing average size of fish. And yet, as Daniel Pauly shows us onstage at Mission Blue, each time the baseline drops, we call it the new ""normal."" At what point do we stop readjusting downward?",00:08:37,8.616666666666667,259804,2012-02-28T17:45:21+00:00,"['data', 'oceans', 'science', 'mission blue', 'fish', 'climate change', 'environment', 'ecology', 'animals', 'biodiversity', 'pollution', 'conservation', 'future', 'prediction', 'population', 'marine biology']","['Bahasa Indonesia', 'Deutsch', 'English', 'Español', 'Français', 'Français canadien', 'Hrvatski', 'Italiano', 'Nederlands', 'Polski', 'Português brasileiro', 'Português de Portugal', 'Română', 'Shqip', 'Tiếng Việt', 'Türkçe', 'Ελληνικά', 'Русский', 'Српски, Srpski', 'български', 'עברית', 'العربية', 'فارسى', '中文 (简体)', '中文 (繁體)', '日本語', '한국어']",Daniel Pauly,Fisheries biologist
https://www.ted.com/talks/diego_prilusky_how_volumetric_video_brings_a_new_dimension_to_filmmaking,How volumetric video brings a new dimension to filmmaking,"In this talk and tech demo, filmmaker Diego Prilusky introduces the next chapter in moviemaking: volumetric video, a 360-degree experience powered by hundreds of cameras that capture light and motion from every angle. Check out how this technology creates a new type of immersive storytelling -- and catch Prilusky's reshoot of an iconic dance number from ""Grease"" captured with volumetric video.",00:11:36,11.6,260292,2020-02-21T15:53:11+00:00,"['entertainment', 'film', 'movies', 'technology', 'creativity', 'innovation', 'media']","['English', 'Español', 'Français', 'Magyar', 'Português brasileiro', 'Português de Portugal', 'Türkçe', 'Русский', 'العربية', 'فارسى', 'မြန်မာဘာသာ', '中文 (简体)', '中文 (繁體)', '한국어']",Diego Prilusky,Filmmaking pioneer
https://www.ted.com/talks/ayana_elizabeth_johnson_a_love_story_for_the_coral_reef_crisis,A love story for the coral reef crisis,"Over the course of hundreds of scuba dives, marine biologist Ayana Elizabeth Johnson fell in love -- with a fish. In this ode to parrotfish, she shares five reasons why these creatures are simply amazing (from their ability to poop white sand to make colorful ""wardrobe changes"") and shows what's at stake -- for us and them -- as climate change threatens the future of coral reefs.",00:06:34,6.566666666666666,259565,2019-10-18T14:44:20+00:00,"['fish', 'oceans', 'sustainability', 'nature', 'coral reefs', 'science', 'conservation']","['Bahasa Indonesia', 'Deutsch', 'English', 'Español', 'Français', 'Italiano', 'Magyar', 'Português brasileiro', 'Português de Portugal', 'Română', 'Svenska', 'Tiếng Việt', 'Türkçe', 'Ελληνικά', 'Русский', 'العربية', 'کوردی', 'ગુજરાતી', '中文 (简体)', '中文 (繁體)', '한국어']",Ayana Elizabeth Johnson,Marine biologist
https://www.ted.com/talks/iseult_gillespie_why_should_you_read_flannery_o_connor,Why should you read Flannery O'Connor?,"Flannery O'Connor scribbled tales of outcasts, intruders and misfits staged in the world she knew best: the American South. She was a master of the grotesque, but her work pushed beyond the purely ridiculous and frightening to reveal the variety and nuance of human character. Iseult Gillespie explores how O'Connor's endlessly surprising fictional worlds continue to draw readers decades later. [Directed by Anton Bogaty, narrated by Christina Greer, music by WORKPLAYWORK and Cem Misirlioglu].",00:03:57,3.95,257383,2019-02-20T20:49:33+00:00,"['TED-Ed', 'animation', 'book', 'books', 'literature', 'writing', 'novel', 'history']","['Bahasa Indonesia', 'English', 'Español', 'Français', 'Kiswahili', 'Português brasileiro', 'Português de Portugal', 'Română', 'Tiếng Việt', 'Türkçe', 'Русский', 'Српски, Srpski', 'עברית', 'العربية', 'فارسى', 'کوردی', 'မြန်မာဘာသာ', '中文 (简体)', '中文 (繁體)', '日本語', '한국어']",Iseult Gillespie,Educator
