video_url,title,description,length,length_in_minutes,views,upload_date,related_tags,translations,speaker_name,speaker_profession
https://www.ted.com/talks/alex_rosenthal_the_artists_think_like_a_coder_ep_5,"The Artists | Think Like A Coder, Ep 5","This is episode 5 of our animated series ""Think Like A Coder."" This 10-episode narrative follows a girl, Ethic, and her robot companion, Hedge, as they attempt to save the world. The two embark on a quest to collect three artifacts and must solve their way through a series of programming puzzles. [Directed by Kozmonot Animation Studio, narrated by Addison Anderson].",00:06:26,6.433333333333334,255878,2020-01-13T16:41:25+00:00,"['animation', 'TED-Ed', 'education', 'engineering', 'code', 'science', 'computers', 'programming']","['English', 'Español', 'Français', 'Português brasileiro', 'Português de Portugal', 'Türkçe', 'Русский', 'עברית', 'العربية', 'မြန်မာဘာသာ', '中文 (简体)', '中文 (繁體)', '日本語']",Alex Rosenthal,Producer
https://www.ted.com/talks/ilan_stavans_romance_and_revolution_the_poetry_of_pablo_neruda,Romance and revolution: the poetry of Pablo Neruda,"A romantic and a revolutionary, Pablo Neruda was one of the most celebrated poets of the 20th century, but also one of the most accessible and controversial. Originally written in Spanish, his poems often use straightforward language and everyday experience to create lasting impact. Ilan Stavans traces the life and legacy of the Chilean poet. [Directed by Ivana Bosnjak and Thomas Johnson, narrated by Ilan Stavans, music by Stephen LaRosa].",00:04:30,4.5,254676,2019-07-23T18:33:35+00:00,"['Latin America', 'TED-Ed', 'animation', 'war', 'poetry', 'love', 'politics', 'writing']","['English', 'Español', 'Français', 'Italiano', 'Português brasileiro', 'Português de Portugal', 'Română', 'Türkçe', 'Ελληνικά', 'Русский', 'Српски, Srpski', 'עברית', 'العربية', 'فارسى', 'မြန်မာဘာသာ', '中文 (简体)', '中文 (繁體)', '日本語', '한국어']",Ilan Stavans,Educator
https://www.ted.com/talks/matt_porter_and_margaret_hamilton_nasa_s_first_software_engineer_margaret_hamilton,NASA's first software engineer: Margaret Hamilton,"The Apollo 11 moon landing was about the astronauts, mission control, software and hardware all working together as a seamless integrated system. None of which would have been possible without the contributions of one engineer: Margaret Hamilton. Who was this pioneer? Matt Porter and Margaret Hamilton detail how a woman and her team launched the software that took mankind to the Moon. [Directed by TOTEM Studio, narrated by Bethany Cutmore-Scott, music by Julián André].",00:04:50,4.833333333333333,253305,2020-03-05T22:50:34+00:00,"['TED-Ed', 'animation', 'education', 'science', 'Moon', 'technology', 'women', 'software', 'invention', 'feminism', 'computers', 'innovation', 'code', 'history', 'space', 'engineering']","['English', 'Español', 'Français', 'Magyar', 'Português brasileiro', 'Português de Portugal', 'Română', 'Türkçe', 'Ελληνικά', 'Русский', 'Српски, Srpski', 'Українська', 'български', 'العربية', 'فارسى', 'हिन्दी', 'မြန်မာဘာသာ', '中文 (简体)', '中文 (繁體)', '日本語', '한국어']",Matt Porter,Educator
https://www.ted.com/talks/paul_mceuen_and_marc_miskin_tiny_robots_with_giant_potential,Tiny robots with giant potential,"Take a trip down the microworld as roboticists Paul McEuen and Marc Miskin explain how they design and mass-produce microrobots the size of a single cell, powered by atomically thin legs -- and show how these machines could one day be ""piloted"" to battle crop diseases or study your brain at the level of individual neurons.",00:13:03,13.05,254290,2020-02-04T15:58:48+00:00,"['robots', 'future', 'technology', 'design', 'innovation', 'engineering', 'science', 'invention']","['Deutsch', 'English', 'Español', 'Français', 'Hrvatski', 'Italiano', 'Magyar', 'Nederlands', 'Português brasileiro', 'Português de Portugal', 'Română', 'Türkçe', 'العربية', 'فارسى', 'မြန်မာဘာသာ', '中文 (简体)', '中文 (繁體)', '日本語', '한국어']",Paul McEuen,Physicist
https://www.ted.com/talks/a_tribe_called_red_we_are_the_halluci_nation,"""We Are the Halluci Nation""","A Tribe Called Red creates music that acts as a gateway into urban, contemporary indigenous culture, celebrating all of its layers and complexity. In a set that blends traditional powwow drums and vocals with hip-hop and electronic music, the DJ collective tells stories of the First Nations in beats and images -- expanding on the concept of the ""Halluci Nation,"" inspired by the poet, musician and activist John Trudell.",00:11:19,11.316666666666666,251896,2018-10-26T12:41:26+00:00,"['art', 'music', 'indigenous peoples', 'performance art', 'performance']","['Bahasa Indonesia', 'English', 'Español', 'Français', 'Magyar', 'Nederlands', 'Português brasileiro', 'Português de Portugal', 'Türkçe', 'Русский', 'Српски, Srpski', 'עברית', 'العربية', 'فارسى', '中文 (简体)', '中文 (繁體)', '日本語', '한국어']",A Tribe Called Red,DJ collective
https://www.ted.com/talks/dan_schulman_what_covid_19_means_for_the_future_of_commerce_capitalism_and_cash,"What COVID-19 means for the future of commerce, capitalism and cash","Capitalism needs an upgrade, says PayPal CEO Dan Schulman, and it starts with paying people enough to actually invest in their futures. He discusses why companies need to cultivate trust to recover and rebuild after the COVID-19 pandemic -- and how we can use this defining moment to create a more inclusive, ethical economy. (This virtual conversation, hosted by TED business curator Corey Hajim and current affairs curator Whitney Pennington Rodgers, was recorded on May 19, 2020.)",00:49:09,49.15,259031,2020-05-29T19:47:17+00:00,"['capitalism', 'work', 'finance', 'money', 'business', 'economics']","['English', 'Español', 'Português brasileiro', 'Türkçe']",Dan Schulman,"President and CEO, PayPal"
https://www.ted.com/talks/matt_trombley_the_beauty_and_complexity_of_finding_common_ground,The beauty and complexity of finding common ground,"How can we disagree with one another, respectfully and productively? In this thoughtful talk, team builder Matt Trombley reflects on ""agonism"" -- the tendency to take a rigid stance on issues -- and shares why finding aspects of agreement can be the first step in resolving conflict. ""When you can find even the smallest bit of common ground with somebody, it allows you to understand the beautiful wonder and complexity and majesty of the other person,"" he says.",00:13:52,13.866666666666667,276061,2020-06-26T14:49:40+00:00,"['humanity', 'community', 'communication', 'personal growth', 'relationships']","['English', 'Español', 'Français', 'Português brasileiro', 'Română', 'Ελληνικά', 'العربية', 'فارسى', '中文 (简体)', '中文 (繁體)']",Matt Trombley,"Maven, teacher, team builder"
https://www.ted.com/talks/david_lindell_a_camera_that_can_see_around_corners,A camera that can see around corners,"To work safely, self-driving cars must avoid obstacles -- including those just out of sight. And for this to happen, we need technology that sees better than humans can, says electrical engineer David Lindell. Buckle up for a quick, groundbreaking tech demo as Lindell explains the significant and versatile potential of a high-speed camera that can detect objects hidden around corners.",00:07:27,7.45,254215,2020-03-24T15:14:45+00:00,"['cars', 'technology', 'demo', 'transportation', 'driverless cars', 'TEDx']","['Bahasa melayu', 'Català', 'English', 'Español', 'Français', 'Galego', 'Magyar', 'Nederlands', 'Português brasileiro', 'Português de Portugal', 'Română', 'Suomi', 'Svenska', 'Türkçe', 'Српски, Srpski', 'עברית', 'العربية', 'فارسى', 'کوردی', '中文 (简体)', '中文 (繁體)', '日本語', '한국어']",David Lindell,Electrical engineer
https://www.ted.com/talks/james_forbes_compassion_at_the_dinner_table,Compassion at the dinner table,"Join Rev. James Forbes at the dinner table of his Southern childhood, where his mother and father taught him what compassion really means day to day -- sharing with those who need love.",00:18:24,18.4,249961,2008-10-31T04:45:00+00:00,"['charter for compassion', 'compassion', 'faith', 'global issues', 'life', 'religion']","['Deutsch', 'English', 'Español', 'Français', 'Italiano', 'Nederlands', 'Polski', 'Português brasileiro', 'Română', 'Tiếng Việt', 'Türkçe', 'Čeština', 'Русский', 'български', 'עברית', 'العربية', '中文 (简体)', '中文 (繁體)', '日本語', '한국어']",James Forbes,Preacher
https://www.ted.com/talks/jiabao_li_art_that_reveals_how_technology_frames_reality,Art that reveals how technology frames reality,"In a talk that could change how you see things, designer and artist Jiabao Li introduces her conceptual projects that expose the inherent bias of digital media. From a helmet that makes you ""allergic"" to the color red to a browser plug-in that filters the internet in an unexpected way, Li's creations uncover how technology mediates the way we perceive reality.",00:08:14,8.233333333333333,250612,2020-03-04T15:55:07+00:00,"['art', 'social media', 'interface design', 'technology', 'culture', 'creativity', 'media']","['Català', 'Deutsch', 'English', 'Español', 'Français', 'Hrvatski', 'Magyar', 'Português brasileiro', 'Português de Portugal', 'Српски, Srpski', 'Українська', 'עברית', 'العربية', 'हिन्दी', '中文 (简体)', '中文 (繁體)', '日本語', '한국어']",Jiabao Li,Perception designer
https://www.ted.com/talks/lisa_janae_bacon_the_life_legacy_assassination_of_an_african_revolutionary,"The life, legacy & assassination of an African revolutionary","In 1972, Thomas Sankara was swept into the revolution seeking to wrest control of Madagascar from France's lingering colonial rule. The protests inspired the West African native to read works by socialist leaders and seek wisdom from military strategy. Leaving Madagascar in 1973, he was determined to free his country from its colonial legacy. Lisa Bacon details the life of the revolutionary icon. [Directed by Tomás Pichardo-Espaillat, narrated by Christina Greer, music by WORKPLAYWORK / Cem Misirlioglu].",00:05:08,5.133333333333334,251288,2020-02-03T19:02:52+00:00,"['animation', 'TED-Ed', 'Africa', 'education', 'activism', 'government', 'feminism', 'social change', 'economics', 'history', 'leadership', 'war', 'women', 'society', 'capitalism', 'politics']","['English', 'Español', 'Français', 'Português brasileiro', 'Português de Portugal', 'Română', 'Türkçe', 'العربية', 'فارسى', '中文 (简体)', '中文 (繁體)', '한국어']",Lisa Janae Bacon,Educator
https://www.ted.com/talks/melissa_garren_the_sea_we_ve_hardly_seen,The sea we've hardly seen,"An average teaspoon of ocean water contains five million bacteria and fifty million viruses -- and yet we are just starting to discover how these ""invisible engineers"" control our ocean's chemistry. At TEDxMonterey, Melissa Garren sheds light on marine microbes that provide half the oxygen we breathe, maintain underwater ecosystems, and demonstrate surprising hunting skills. (Apologies for the small audio glitches in this video.)",00:11:29,11.483333333333333,248603,2012-05-20T14:01:08+00:00,"['TEDx', 'biodiversity', 'biology', 'microbiology', 'oceans', 'science', 'nanoscale', 'environment', 'health', 'bacteria', 'disease', 'microbes', 'pollution', 'climate change', 'innovation', 'biotech']","['English', 'Español', 'Français', 'Hrvatski', 'Italiano', 'Magyar', 'Polski', 'Português brasileiro', 'Português de Portugal', 'Tiếng Việt', 'Türkçe', 'Русский', 'Українська', 'עברית', 'العربية', '中文 (简体)', '中文 (繁體)', '한국어']",Melissa Garren,Marine biologist
https://www.ted.com/talks/luke_sital_singh_afterneath_killing_me,"""Afterneath"" / ""Killing Me""","Luke Sital-Singh sings songs of love, longing and grief in this stirring performance of ""Afterneath"" and ""Killing Me."" ""These are the songs I just never tire of hearing and I never tire of writing, because they make me feel less alone,"" Sital-Singh says.",00:11:40,11.666666666666666,247986,2018-09-21T12:50:01+00:00,"['piano', 'music', 'singer', 'live music', 'performance']","['English', 'Español', 'Français', 'Português brasileiro', 'Svenska', 'Türkçe', 'Русский', 'العربية', 'فارسى', 'မြန်မာဘာသာ', '中文 (简体)', '中文 (繁體)', '한국어']",Luke Sital-Singh,Singer-songwriter
https://www.ted.com/talks/iseult_gillespie_how_to_see_more_and_care_less_the_art_of_georgia_o_keeffe,How to see more and care less: The art of Georgia O'Keeffe,"Feeling disconnected from creating art within classical conventions, artist Georgia O'Keeffe began experimenting with abstract drawings that defied easy classification. Using the shapes and rhythms of nature to capture her internal world, these experiments became the cornerstone of the movement known as American Modernism. Iseult Gillespie explores the works of the elusive painter and sculptor. [Directed by Lisa LaBracio, narrated by Christina Greer, music by M. Tomihisa].",00:04:39,4.65,249148,2020-06-08T15:43:21+00:00,"['art', 'education', 'TED-Ed', 'animation', 'culture', 'history', 'arts', 'painting', 'nature', 'gender', 'women']","['English', 'Español', 'Français', 'Português brasileiro', 'Português de Portugal', 'Română', 'Русский', 'العربية', 'မြန်မာဘာသာ', '中文 (简体)', '中文 (繁體)', '日本語']",Iseult Gillespie,Educator
https://www.ted.com/talks/yelle_interpassion_ba_in,"""Interpassion"" / ""Ba$$in""","Yelle and GrandMarnier bring their danceable electropop hits to the TED stage in an energizing performance of two songs, ""Interpassion"" and ""Ba$$in.""",00:07:14,7.233333333333333,245806,2018-08-20T12:53:28+00:00,"['live music', 'music', 'performance', 'performance art', 'dance', 'singer']","['English', 'Español', 'Français', 'Magyar', 'Português brasileiro', 'Türkçe', 'Русский', 'العربية', 'فارسى', 'မြန်မာဘာသာ', '中文 (简体)', '中文 (繁體)', '한국어']",Yelle,Band
https://www.ted.com/talks/jamais_cascio_tools_for_a_better_world,Tools for a better world,We all want to make the world better -- but how? Jamais Cascio looks at some specific tools and techniques that can make a difference. It's a fascinating talk that might just inspire you to act.,00:16:03,16.05,240382,2009-01-21T01:00:00+00:00,"['culture', 'future', 'global issues', 'social change', 'technology']","['English', 'Español', 'Français', 'Italiano', 'Nederlands', 'Polski', 'Português brasileiro', 'Română', 'Tiếng Việt', 'Türkçe', 'Русский', 'български', 'עברית', 'العربية', '中文 (简体)', '中文 (繁體)', '日本語', '한국어']",Jamais Cascio,World-builder
https://www.ted.com/talks/david_birch_a_new_way_to_stop_identity_theft,A new way to stop identity theft,"Bartenders need to know your age, retailers need your PIN, but almost no one actually needs your name -- except for identity thieves. ID expert David Birch proposes a safer approach to personal identification -- a ""fractured"" approach -- that would almost never require your real name.",00:16:56,16.933333333333334,240347,2012-06-03T14:08:36+00:00,"['TEDx', 'security', 'self', 'technology']","['English', 'Español', 'Français', 'Italiano', 'Magyar', 'Nederlands', 'Português brasileiro', 'Română', 'Tiếng Việt', 'Ελληνικά', 'Русский', 'עברית', 'العربية', 'فارسى', '中文 (简体)', '中文 (繁體)', '日本語', '한국어']",David Birch,Digital money and identity consultant
https://www.ted.com/talks/judith_jamison_and_members_of_the_alvin_ailey_american_dance_theater_revelations_from_a_lifetime_of_dance,Revelations from a lifetime of dance,"""Dance can elevate our human experience beyond words,"" says Judith Jamison, artistic director emerita of the Alvin Ailey American Dance Theater. In between performances of excerpts from Alvin Ailey's classic works ""Revelations"" and ""Cry,"" Jamison reflects on the enduring power of dance to transform history into art that thrills audiences around the world. (Performances by Solomon Dumas, Samantha Figgins and Constance Stamatiou)",00:16:58,16.966666666666665,239306,2019-10-11T14:59:29+00:00,"['dance', 'performance', 'performance art', 'art', 'entertainment']","['English', 'Español', 'Français', 'Italiano', 'Português brasileiro', 'Português de Portugal', 'Română', 'Српски, Srpski', 'العربية', 'हिन्दी', '中文 (简体)', '中文 (繁體)', '한국어']",Judith Jamison,"Dancer, choreographer"
https://www.ted.com/talks/gareth_gaskell_how_do_our_brains_process_speech,How do our brains process speech?,"The average 20-year-old knows between 27,000 and 52,000 different words. Spoken out loud, most of these words last less than a second. With every word, the brain has a quick decision to make: which of those thousands of options matches the signal? And about 98% of the time, the brain chooses the correct word. How is this possible? Gareth Gaskell digs into the complexities of speech comprehension. [Directed by Art Shot, narrated by Addison Anderson, music by Stephen LaRosa].",00:04:22,4.366666666666666,277804,2020-07-23T18:37:33+00:00,"['education', 'TED-Ed', 'speech', 'animation', 'neurology', 'language', 'brain', 'memory', 'science', 'biology', 'neuroscience']","['Deutsch', 'English', 'Nederlands', 'Português de Portugal', 'Türkçe', 'کوردی', 'မြန်မာဘာသာ', '中文 (繁體)']",Gareth Gaskell,Educator
https://www.ted.com/talks/giles_duley_when_a_reporter_becomes_the_story,When a reporter becomes the story,"Giles Duley gave up a life of glamour and celebrity as a fashion photographer to travel the world and document the stories of the forgotten and marginalized. While on assignment in Afghanistan he stepped on a landmine, a horrific event that left him a triple amputee. In this moving talk Duley tells us stories of lives lost and found -- including his.",00:11:43,11.716666666666667,236743,2012-07-29T14:55:00+00:00,"['TEDx', 'culture', 'disability', 'photography', 'storytelling', 'violence', 'war', 'journalism', 'personal growth']","['English', 'Español', 'Français', 'Italiano', 'Magyar', 'Português brasileiro', 'Română', 'Svenska', 'Tiếng Việt', 'Türkçe', 'Ελληνικά', 'Русский', 'Српски, Srpski', 'Українська', 'עברית', 'العربية', 'فارسى', '中文 (简体)', '中文 (繁體)', '日本語', '한국어']",Giles Duley,Photojournalist
https://www.ted.com/talks/a_j_jacobs_the_evolution_of_the_coffee_cup_lid,The evolution of the coffee cup lid,Author A.J. Jacobs shows how the coffee cup lid was perfectly designed to give you a full sensory experience while drinking.,00:02:52,2.8666666666666667,238617,2020-02-17T20:20:44+00:00,"['design', 'food', 'creativity']","['English', 'Español', 'Français', 'Polski', 'Português brasileiro', 'Română', 'Türkçe', 'Русский', 'العربية', 'فارسى', 'کوردی', 'မြန်မာဘာသာ', '中文 (简体)', '中文 (繁體)', '日本語']",A.J. Jacobs,Author
https://www.ted.com/talks/anees_bahji_can_steroids_save_your_life,Can steroids save your life?,"Steroids: they're infamous for their use in sports. But they're also found in inhalers, creams to treat poison ivy and eczema, and shots to ease inflammation. The steroids in these medicines aren't the same as those used to build muscle. In fact, they're all based on yet another steroid— one our body produces naturally, and we can't live without. Anees Bahji explores the science of corticosteroids. [Directed by Nick Hilditch, narrated by Addison Anderson, music by Audionetwork].",00:05:12,5.2,238543,2020-06-17T15:03:40+00:00,"['education', 'TED-Ed', 'innovation', 'animation', 'illness', 'medicine', 'disease', 'medical research', 'science', 'biology', 'health care', 'health', 'healthcare']","['English', 'Español', 'Français', 'Magyar', 'Português brasileiro', 'Português de Portugal', 'Română', 'Türkçe', '中文 (简体)', '中文 (繁體)', '日本語']",Anees Bahji,Educator
https://www.ted.com/talks/anne_marie_albano_how_to_raise_kids_who_can_overcome_anxiety,How to raise kids who can overcome anxiety,"Growing up means facing new challenges -- but for some kids, uncertain situations lead to anxiety that parents often seek to soothe. Psychologist Anne Marie Albano explains how constantly rushing to fix a child's problems can perpetuate a lifelong cycle of dependence and resentment -- and shares why a healthy dose of risk helps kids cultivate lasting confidence.",00:15:11,15.183333333333334,244489,2020-05-27T19:24:32+00:00,"['psychology', 'parenting', 'mental health', 'children', 'personal growth', 'relationships', 'self']","['Deutsch', 'English', 'Français', 'Magyar', 'Português brasileiro', 'Português de Portugal', 'Türkçe', 'Русский', 'العربية', 'हिन्दी', '中文 (简体)', '中文 (繁體)', '한국어']",Anne Marie Albano,Psychologist
https://www.ted.com/talks/susan_shaw_the_oil_spill_s_toxic_trade_off,The oil spill's toxic trade-off,"Break down the oil slick, keep it off the shores: that's grounds for pumping toxic dispersant into the Gulf, say clean-up overseers. Susan Shaw shows evidence it's sparing some beaches only at devastating cost to the health of the deep sea.",00:16:28,16.466666666666665,235443,2016-04-22T22:03:41+00:00,"['TEDx', 'business', 'chemistry', 'disaster relief', 'environment', 'fish', 'oceans', 'oil', 'science']","['Deutsch', 'English', 'Español', 'Français', 'Italiano', 'Nederlands', 'Polski', 'Português brasileiro', 'Português de Portugal', 'Română', 'Русский', 'български', 'עברית', 'العربية', '中文 (简体)', '中文 (繁體)', '日本語', '한국어']",Susan Shaw,Marine toxicologist
https://www.ted.com/talks/muthoni_drummer_queen_creativity_builds_nations,Creativity builds nations,"In a hopeful talk followed by an empowering performance, musician and TED Fellow Muthoni Drummer Queen shares how industries like music, film and fashion provide a platform for Africans to broadcast their rich and diverse talents -- and explains how the shared experience of creativity can replace attitudes of exclusionism and othering with acceptance and self-love.",00:11:49,11.816666666666666,233721,2019-09-27T16:16:40+00:00,"['performance', 'music', 'art', 'Africa', 'culture', 'creativity', 'future', 'live music', 'TED Fellows']","['English', 'Español', 'Français', 'Kiswahili', 'Português brasileiro', 'Português de Portugal', 'Türkçe', 'Русский', 'العربية', 'ગુજરાતી', '中文 (简体)', '中文 (繁體)', '한국어']",Muthoni Drummer Queen,Musician
https://www.ted.com/talks/madame_gandhi_and_amber_galloway_gallego_music_with_a_message_should_be_accessible,Music with a message should be accessible,"""Music is so much more than sound simply traveling through the ear,"" says sign language interpreter Amber Galloway-Gallego. In a spirited performance, musician and activist Madame Gandhi plays two songs -- ""Top Knot Turn Up"" and ""Bad Habits"" -- while Galloway-Gallego provides an animated sign language interpretation.",00:12:40,12.666666666666666,232736,2018-12-14T13:58:12+00:00,"['music', 'performance', 'performance art', 'entertainment', 'live music']","['English', 'Español', 'Français', 'Nederlands', 'Polski', 'Português brasileiro', 'Português de Portugal', 'Türkçe', 'Русский', 'العربية', '中文 (简体)', '中文 (繁體)', '日本語', '한국어']",Madame Gandhi,"Activist, musician"
https://www.ted.com/talks/pedro_brugarolas_why_do_hospitals_have_particle_accelerators,Why do hospitals have particle accelerators?,"Is there a way to detect diseases like cancer and Alzheimer's before they advance too far? Doctors are using injected radioactive drugs that circulate through the body and act as a beacon for PET scanners. These diagnostic tools can detect the spread of diseases before they can be spotted with other types of imaging. So how exactly does this work, and is it safe? Pedro Brugarolas investigates.",00:04:28,4.466666666666667,231757,2019-03-19T18:14:11+00:00,"['TED-Ed', 'animation', 'medicine', 'medical imaging', 'medical research', 'biology', 'innovation', 'invention', ""Alzheimer's"", 'disability', 'science', 'testing', 'health care', 'disease', 'public health', 'cancer', 'health', 'technology', 'healthcare']","['Bahasa Indonesia', 'English', 'Español', 'Français', 'Nederlands', 'Português brasileiro', 'Português de Portugal', 'Română', 'Tiếng Việt', 'Türkçe', 'Ελληνικά', 'Русский', 'עברית', 'العربية', '中文 (简体)', '中文 (繁體)', '日本語', '한국어']",Pedro Brugarolas,Educator
