video_url,title,description,length,length_in_minutes,views,upload_date,related_tags,translations,speaker_name,speaker_profession,orig
https://www.ted.com/talks/ellen_t_hoen_pool_medical_patents_save_lives,"Pool medical patents, save lives","Patenting a new drug helps finance its immense cost to develop -- but that same patent can put advanced treatments out of reach for sick people in developing nations, at deadly cost. Ellen 't Hoen talks about an elegant, working solution to the problem: the Medicines Patent Pool.",0:11:01,11.01666667,432185,2012-12-10T16:18:24+00:00,"['TEDx', 'collaboration', 'health', 'health care', 'history', 'invention', 'medicine', 'science', 'open-source', 'medical research', 'pharmaceuticals', 'AIDS', 'disease', 'HIV', 'pandemic', 'illness', 'business', 'bioethics', 'public health', 'morality', 'society', 'social change', 'activism']","['Deutsch', 'English', 'Español', 'Français', 'Italiano', 'Nederlands', 'Polski', 'Português brasileiro', 'Português de Portugal', 'Română', 'Slovenčina', 'Tiếng Việt', 'Türkçe', 'Русский', 'Српски, Srpski', 'Українська', 'български', 'עברית', 'العربية', 'ภาษาไทย', '中文 (简体)', '中文 (繁體)', '日本語', '한국어']",Ellen 't Hoen,Medicine law expert,unpopular
https://www.ted.com/talks/graham_hawkes_a_flight_through_the_ocean,A flight through the ocean,"Graham Hawkes takes us aboard his graceful, winged submarines to the depths of planet Ocean (a.k.a. ""Earth""). It's a deep blue world we landlubbers rarely see in 3D.",0:11:53,11.88333333,431960,2008-11-03T01:00:00+00:00,"['business', 'design', 'exploration', 'invention', 'oceans', 'technology', 'global commons']","['Bahasa Indonesia', 'Deutsch', 'English', 'Español', 'Français', 'Hrvatski', 'Italiano', 'Nederlands', 'Polski', 'Português brasileiro', 'Português de Portugal', 'Română', 'Tiếng Việt', 'Türkçe', 'Русский', 'български', 'עברית', 'العربية', '中文 (简体)', '中文 (繁體)', '日本語', '한국어']",Graham Hawkes,Inventor,unpopular
https://www.ted.com/talks/poet_ali_the_language_of_being_human,The language of being human,"You speak far more languages than you realize, says Poet Ali. In a profound talk, he reveals how the idea of ""language"" goes far beyond a lexicon of words, communicating universal experiences like love, laughter and loneliness -- and serving as a portal to cultures, feelings and thoughts that unite us all.",0:14:47,14.78333333,441177,2020-05-15T14:49:26+00:00,"['poetry', 'language', 'humanity', 'emotions', 'culture', 'empathy']","['Deutsch', 'English', 'Español', 'Français', 'Magyar', 'Português brasileiro', 'Português de Portugal', 'Türkçe', 'Ελληνικά', 'Русский', 'Српски, Srpski', 'עברית', 'العربية', 'မြန်မာဘာသာ', '中文 (简体)', '中文 (繁體)', '日本語', '한국어']",Poet Ali,"Catalyst of human connectivity, designer at heart",unpopular
https://www.ted.com/talks/ernest_madu_world_class_health_care,World-class health care,"Dr. Ernest Madu runs the Heart Institute of the Caribbean in Kingston, Jamaica, where he proves that -- with careful design, smart technical choices, and a true desire to serve -- it's possible to offer world-class healthcare in the developing world.",0:16:32,16.53333333,431571,2008-04-17T01:25:00+00:00,"['Africa', 'activism', 'global issues', 'health', 'health care', 'heart health', 'public health', 'science', 'global development']","['Deutsch', 'English', 'Español', 'Français', 'Hrvatski', 'Italiano', 'Polski', 'Português brasileiro', 'Română', 'Tiếng Việt', 'Türkçe', 'Русский', 'български', 'עברית', 'العربية', '中文 (简体)', '中文 (繁體)', '日本語', '한국어']",Ernest Madu,Cardiologist,unpopular
https://www.ted.com/talks/lawrence_lessig_re_examining_the_remix,Re-examining the remix,"Former ""young Republican"" Larry Lessig talks about what Democrats can learn about copyright from their opposite party, considered more conservative. A surprising lens on remix culture.",0:18:30,18.5,431179,2010-05-31T11:13:00+00:00,"['Internet', 'TEDx', 'law', 'music', 'online video', 'technology', 'web']","['Deutsch', 'English', 'Español', 'Français', 'Italiano', 'Lietuvių kalba', 'Nederlands', 'Polski', 'Português brasileiro', 'Português de Portugal', 'Română', 'Tiếng Việt', 'Türkçe', 'Čeština', 'Русский', 'български', 'עברית', 'العربية', 'ภาษาไทย', '中文 (简体)', '中文 (繁體)', '日本語', '한국어']",Lawrence Lessig,Legal activist,unpopular
https://www.ted.com/talks/inge_missmahl_bringing_peace_to_the_minds_of_afghanistan,Bringing peace to the minds of Afghanistan,"When Jungian analyst Inge Missmahl visited Afghanistan, she saw the inner wounds of war -- widespread despair, trauma and depression. And yet, in this county of 30 million people, there were only two dozen psychiatrists. Missmahl talks about her work helping to build the country's system of psychosocial counseling, promoting both individual and, perhaps, national healing.",0:10:26,10.43333333,431251,2010-09-29T08:24:00+00:00,"['brain', 'depression', 'global issues', 'mental health', 'peace', 'poverty', 'psychology', 'violence', 'war', 'PTSD']","['Bahasa Indonesia', 'Dansk', 'Deutsch', 'English', 'Español', 'Français', 'Hrvatski', 'Italiano', 'Nederlands', 'Polski', 'Português brasileiro', 'Português de Portugal', 'Română', 'Tiếng Việt', 'Türkçe', 'Čeština', 'Русский', 'Српски, Srpski', 'български', 'עברית', 'العربية', 'فارسى', 'हिन्दी', '中文 (简体)', '中文 (繁體)', '日本語', '한국어']",Inge Missmahl,Analytical psychologist,unpopular
https://www.ted.com/talks/luka_seamus_wright_the_mysterious_origins_of_life_on_earth,The mysterious origins of life on Earth,"Billions of years ago, simple organic compounds assembled into more complex coalitions that could grow and reproduce. At the time, Earth had widespread volcanic activity and a hostile atmosphere that made it almost devoid of a suitable environment for living things. So where did life begin? Luka Wright searches for the cradle of life that gave rise to the billions of species that inhabit our planet. [Directed by Nick Hilditch, narrated by Addison Anderson].",0:04:38,4.633333333,433254,2019-08-26T17:57:40+00:00,"['TED-Ed', 'life', 'animation', 'space', 'biodiversity', 'science', 'biosphere', 'biology', 'Planets', 'evolution', 'chemistry']","['Bahasa Indonesia', 'English', 'Español', 'Français', 'Italiano', 'Polski', 'Português brasileiro', 'Português de Portugal', 'Tiếng Việt', 'Türkçe', 'Русский', 'עברית', 'العربية', 'فارسى', 'मराठी', 'မြန်မာဘာသာ', '中文 (简体)', '中文 (繁體)', '日本語', '한국어']",Luka Wright,Educator,unpopular
https://www.ted.com/talks/tom_thum_and_matthew_broadhurst_what_happens_in_your_throat_when_you_beatbox,What happens in your throat when you beatbox?,"Viral beatboxer Tom Thum has an orchestra in his mouth, but how does he make all those sounds? Get an up-close-and-personal look as laryngeal surgeon Matthew Broadhurst sticks a camera down Thum's throat while he creates a mind-boggling array of noises. This hilarious, somewhat stomach-churning talk and performance is not for the squeamish! (Contains graphic medical imagery)",0:17:13,17.21666667,431210,2019-03-12T14:56:36+00:00,"['TEDx', 'live music', 'medical imaging', 'music', 'performance', 'entertainment', 'vocals', 'funny', 'creativity']","['Deutsch', 'English', 'Español', 'Français', 'Italiano', 'Polski', 'Português brasileiro', 'Português de Portugal', 'Română', 'Türkçe', 'Русский', 'עברית', 'العربية', 'فارسى', '中文 (简体)', '中文 (繁體)', '日本語', '한국어']",Tom Thum,Beatboxer,unpopular
https://www.ted.com/talks/jesse_byock_the_secret_messages_of_viking_runestones,The secret messages of Viking runestones,"With their navigational skills and advanced longships, the Vikings sustained their seafaring for over 300 years. But for all their might, they left few monuments. Instead, fragments of stone, bark and bone found in the sites of ancient settlements provide the keys to their culture. Many of these objects are inscribed with Old Norse written in runic letters. Jesse Byock explores the ancient language. [Directed by Lisa LaBracio, narrated by Bethany Cutmore-Scott].",0:04:16,4.266666667,340569,2020-02-20T16:03:58+00:00,"['animation', 'TED-Ed', 'education', 'history', 'culture', 'ancient world', 'language', 'world cultures']","['Deutsch', 'English', 'Español', 'Français', 'Italiano', 'Latviešu', 'Magyar', 'Português brasileiro', 'Português de Portugal', 'Română', 'Türkçe', 'Русский', 'Српски, Srpski', 'العربية', 'کوردی', '中文 (简体)', '中文 (繁體)', '日本語']",Jesse Byock,Educator,unpopular
https://www.ted.com/talks/jim_hudspeth_the_beautiful_mysterious_science_of_how_you_hear,"The beautiful, mysterious science of how you hear","Have you ever wondered how your ears work? In this delightful and fascinating talk, biophysicist Jim Hudspeth demonstrates the wonderfully simple yet astonishingly powerful mechanics of hair cells, the microscopic powerhouses that make hearing possible -- and explains how, when it's really quiet, your ears will begin to beam out a spectrum of sounds unique to you.",0:15:35,15.58333333,339942,2020-03-13T14:57:05+00:00,"['science', 'biology', 'neuroscience', 'physics', 'Senses', 'human body', 'hearing']","['English', 'Español', 'Français', 'Magyar', 'Nederlands', 'Português brasileiro', 'Português de Portugal', 'Tiếng Việt', 'العربية', 'فارسى', '中文 (简体)', '中文 (繁體)', '日本語']",Jim Hudspeth,"Biophysicist, neuroscientist",unpopular
https://www.ted.com/talks/peter_beck_small_rockets_are_the_next_space_revolution,Small rockets are the next space revolution,"We're in the dawn of a new space revolution, says engineer Peter Beck: the revolution of the small. In a talk packed with insights into the state of the space industry, Beck shares his work building rockets capable of delivering small payloads to space rapidly and reliably -- helping us search for extraterrestrial life, learn more about the solar system and create a global internet network.",0:11:24,11.4,338125,2019-11-12T16:08:48+00:00,"['3D printing', 'space', 'science', 'technology', 'exploration', 'entrepreneur']","['English', 'Español', 'Français', 'Magyar', 'Русский']",Peter Beck,Rocket entrepreneur,unpopular
https://www.ted.com/talks/bart_knols_3_new_ways_to_kill_mosquitoes,3 new ways to kill mosquitoes,"We can use a mosquito's own instincts against her. In a rather unforgettable presentation, Bart Knols demos the imaginative solutions his team is developing to fight malaria -- including Limburger cheese and a deadly pill.",0:10:05,10.08333333,334756,2012-05-13T14:03:24+00:00,"['TEDx', 'global issues', 'health', 'insects', 'medicine']","['Bahasa Indonesia', 'Deutsch', 'English', 'Español', 'Français', 'Italiano', 'Latviešu', 'Magyar', 'Nederlands', 'Polski', 'Português brasileiro', 'Português de Portugal', 'Română', 'Tiếng Việt', 'Türkçe', 'Ελληνικά', 'Русский', 'Српски, Srpski', 'Українська', 'עברית', 'العربية', 'فارسى', 'کوردی', 'ภาษาไทย', '中文 (简体)', '中文 (繁體)', '日本語', '한국어']",Bart Knols,Malariologist,unpopular
https://www.ted.com/talks/lucien_engelen_crowdsource_your_health,Crowdsource your health,"You can use your smartphone to find a local ATM, but what if you need a defibrillator? Lucien Engelen shows us online innovations that are changing the way we save lives, including a crowdsourced map of local AEDs.",0:05:58,5.966666667,334252,2012-02-15T16:07:52+00:00,"['TEDx', 'health', 'health care', 'medicine', 'public health', 'technology', 'exercise']","['Bahasa Indonesia', 'Dansk', 'Deutsch', 'English', 'Español', 'Français', 'Français canadien', 'Hrvatski', 'Italiano', 'Latviešu', 'Nederlands', 'Polski', 'Português brasileiro', 'Português de Portugal', 'Română', 'Shqip', 'Tiếng Việt', 'Türkçe', 'Ελληνικά', 'Русский', 'Српски, Srpski', 'Українська', 'български', 'עברית', 'العربية', 'فارسى', 'ภาษาไทย', '中文 (简体)', '中文 (繁體)', '日本語', '한국어']",Lucien Engelen,Healthcare innovator,unpopular
https://www.ted.com/talks/ma_yansong_urban_architecture_inspired_by_mountains_clouds_and_volcanoes,"Urban architecture inspired by mountains, clouds and volcanoes","Taking inspiration from nature, architect Ma Yansong designs breathtaking buildings that break free from the boxy symmetry of so many modern cities. His exuberant and graceful work -- from a pair of curvy skyscrapers that ""dance"" with each other to an opera house that looks like a snow-capped mountain -- shows us the beauty of architecture that defies norms.",0:12:43,12.71666667,333420,2019-11-07T20:51:46+00:00,"['nature', 'cities', 'architecture', 'urban planning', 'art', 'urban', 'beauty']","['English', 'Español', 'Français', 'Italiano', 'Português brasileiro', 'Português de Portugal', 'Română', 'Türkçe', 'Ελληνικά', 'Русский', 'Српски, Srpski', 'עברית', 'العربية', '中文 (简体)', '中文 (繁體)', '日本語', '한국어']",Ma Yansong,"Architect, artist",unpopular
https://www.ted.com/talks/ben_katchor_comics_of_bygone_new_york,Comics of bygone New York,"In this captivating talk from the TED archive, cartoonist Ben Katchor reads from his comic strips. These perceptive, surreal stories find the profound hopes and foibles of history (and modern New York) preserved in objects like light switches and signs.",0:10:59,10.98333333,331278,2009-04-22T21:51:00+00:00,"['New York', 'art', 'cities', 'humor', 'books', 'comedy']","['Bahasa Indonesia', 'Deutsch', 'English', 'Español', 'Français', 'Hrvatski', 'Italiano', 'Nederlands', 'Polski', 'Português brasileiro', 'Română', 'Tiếng Việt', 'Türkçe', 'Čeština', 'Ελληνικά', 'Русский', 'български', 'עברית', 'العربية', 'فارسى', 'کوردی', '中文 (简体)', '中文 (繁體)', '日本語', '한국어']",Ben Katchor,Cartoonist,unpopular
https://www.ted.com/talks/felix_dennis_odes_to_vice_and_consequences,Odes to vice and consequences,"Media big shot Felix Dennis roars his fiery, funny, sometimes racy original poetry, revisiting haunting memories and hard-won battle scars from a madcap -- yet not too repentant -- life. Best enjoyed with a glass of wine.",0:17:12,17.2,329861,2009-06-05T08:11:00+00:00,"['entertainment', 'history', 'literature', 'poetry', 'writing', 'books']","['Deutsch', 'English', 'Español', 'Français', 'Italiano', 'Polski', 'Português brasileiro', 'Română', 'Tiếng Việt', 'Русский', 'български', 'עברית', 'العربية', '中文 (简体)', '中文 (繁體)', '日本語', '한국어']",Felix Dennis,"Publisher, philanthropist, poet",unpopular
https://www.ted.com/talks/beau_lotto_and_cirque_du_soleil_how_we_experience_awe_and_why_it_matters,How we experience awe — and why it matters,"Neuroscientist Beau Lotto conducted an ambitious study with Cirque du Soleil on the emotion of awe and its psychological and behavioral benefits. In this talk and live performance, he shares some of their findings -- and stands back as Cirque du Soleil dancers create their own awe-inducing spectacle.",0:14:41,14.68333333,331993,2019-10-25T14:56:04+00:00,"['science', 'creativity', 'brain', 'neuroscience', 'art', 'humanity']","['English', 'Español', 'Français', 'Italiano', 'Magyar', 'Nederlands', 'Português brasileiro', 'Português de Portugal', 'Türkçe', 'Ελληνικά', 'Русский', 'Українська', 'עברית', 'العربية', 'فارسى', 'ગુજરાતી', 'ქართული', '中文 (简体)', '中文 (繁體)', '日本語', '한국어']",Beau Lotto,Neuroscientist,unpopular
https://www.ted.com/talks/smruti_jukur_johari_what_if_the_poor_were_part_of_city_planning,What if the poor were part of city planning?,"Almost a billion people worldwide live in informal communities and slums, often without basic infrastructure like clean water, toilets or adequate roads. Urban planner Smruti Jukur Johari breaks down myths about these communities and shares examples of simple, common-sense solutions that arise when governments and architects work together with the residents -- instead of around them.",0:13:20,13.33333333,328238,2020-02-06T15:51:10+00:00,"['poverty', 'global issues', 'big problems', 'global development', 'architecture', 'cities', 'infrastructure', 'humanity', 'urban planning']","['English', 'Español', 'Français', 'Português brasileiro', 'Português de Portugal', 'Tiếng Việt', 'Türkçe', 'العربية', 'کوردی', '中文 (简体)', '中文 (繁體)', '日本語', '한국어']",Smruti Jukur Johari,Urban planner,unpopular
https://www.ted.com/talks/karin_oberg_the_galactic_recipe_for_a_living_planet,The galactic recipe for a living planet,"Did you know that one of the most notorious poisons is also a key ingredient for life as we know it? Join space chemist Karin Öberg and learn how she scans the universe in search of this paradoxical chemical using ALMA, the world's largest radio telescope, to detect hotbeds of molecular activity and the formation of life-sustaining planets.",0:13:24,13.4,329513,2020-04-10T19:53:34+00:00,"['Planets', 'space', 'chemistry', 'exploration', 'discovery', 'science', 'cosmos', 'universe', 'life']","['English', 'Español', 'Français', 'Magyar', 'Nederlands', 'Polski', 'Português brasileiro', 'Português de Portugal', 'Română', 'Русский', 'български', 'العربية', 'فارسى', '中文 (简体)', '中文 (繁體)', '한국어']",Karin Öberg,Space chemist,unpopular
https://www.ted.com/talks/david_damberger_what_happens_when_an_ngo_admits_failure,What happens when an NGO admits failure,"International aid groups make the same mistakes over and over again. David Damberger analyzes his own engineering failure in India -- and calls for his friends in the development sector to publicly admit, scrutinize and learn from their missteps.",0:12:53,12.88333333,326861,2011-12-11T15:03:39+00:00,"['TEDx', 'engineering', 'global issues', 'global development']",['English'],David Damberger,"Engineer, Social Entrepreneur",unpopular
https://www.ted.com/talks/frederick_balagadde_bio_lab_on_a_microchip,Bio-lab on a microchip,"Drugs alone can't stop disease in sub-Saharan Africa: We need diagnostic tools to match. TED Senior Fellow Frederick Balagadde shows how we can multiply the power and availability of an unwieldy, expensive diagnostic lab -- by miniaturizing it to the size of a chip.",0:04:12,4.2,325261,2010-04-21T09:05:00+00:00,"['TED Fellows', 'biology', 'engineering', 'invention', 'microbiology']","['Bahasa Indonesia', 'Deutsch', 'English', 'Español', 'Français', 'Hrvatski', 'Italiano', 'Lietuvių kalba', 'Magyar', 'Nederlands', 'Polski', 'Português brasileiro', 'Português de Portugal', 'Română', 'Tiếng Việt', 'Türkçe', 'Ελληνικά', 'Русский', 'Српски, Srpski', 'Українська', 'български', 'עברית', 'العربية', 'فارسى', '中文 (简体)', '中文 (繁體)', '日本語', '한국어']",Frederick Balagadde,Inventor,unpopular
https://www.ted.com/talks/soraya_field_fiorio_who_was_the_world_s_first_author,Who was the world's first author?,"4,300 years ago in ancient Sumer, the most powerful person in the city of Ur was banished to wander the vast desert. Her name was Enheduanna, and by the time of her exile, she had written forty-two hymns and three epic poems— and Sumer hadn't heard the last of her. Who was this woman, and why was she exiled? Soraya Field Fiorio details the life of history's first author. [Directed by Laura White, narrated by Christina Greer, music by Phil Brookes].",0:04:35,4.583333333,326721,2020-03-23T15:50:54+00:00,"['TED-Ed', 'animation', 'education', 'writing', 'poetry', 'ancient world', 'literature', 'culture', 'world cultures', 'religion', 'history', 'women']","['Català', 'English', 'Español', 'Français', 'Hrvatski', 'Italiano', 'Nederlands', 'Português brasileiro', 'Português de Portugal', 'Română', 'Türkçe', 'Русский', 'עברית', 'العربية', 'کوردی', '中文 (简体)', '中文 (繁體)', '日本語']",Soraya Field Fiorio,Educator,unpopular
https://www.ted.com/talks/alex_rosenthal_the_train_heist_think_like_a_coder_ep_4,"The Train Heist | Think Like A Coder, Ep 4","This is episode 4 of our animated series ""Think Like A Coder."" This 10-episode narrative follows a girl, Ethic, and her robot companion, Hedge, as they attempt to save the world. The two embark on a quest to collect three artifacts and must solve their way through a series of programming puzzles. [Directed by Kozmonot Animation Studio, narrated by Addison Anderson].",0:05:44,5.733333333,325063,2019-12-09T16:13:47+00:00,"['animation', 'computers', 'TED-Ed', 'education', 'programming', 'science', 'engineering', 'code']","['English', 'Español', 'Français', 'Português brasileiro', 'Português de Portugal', 'Türkçe', 'Ελληνικά', 'Русский', 'עברית', 'العربية', 'کوردی', 'မြန်မာဘာသာ', '中文 (简体)', '中文 (繁體)', '日本語', '한국어']",Alex Rosenthal,Producer,unpopular
https://www.ted.com/talks/thasunda_duckett_6_ways_to_improve_your_relationship_with_money,6 ways to improve your relationship with money,Taking control of our personal finances can feel overwhelming -- but it doesn't have to be. Thasunda Duckett shares how to minimize shame around money and start having honest conversations about how to save.,0:04:03,4.05,327657,2020-02-10T13:42:46+00:00,"['work', 'money', 'work-life balance', 'finance']","['English', 'Español', 'Français', 'Português brasileiro', 'Türkçe', 'Српски, Srpski', 'العربية', 'فارسى', 'کوردی', '中文 (简体)', '中文 (繁體)', '한국어']",Thasunda Duckett,Banking executive,unpopular
https://www.ted.com/talks/amanda_williams_why_i_turned_chicago_s_abandoned_homes_into_art,Why I turned Chicago's abandoned homes into art,"Amanda Williams shares her lifelong fascination with the complexity of color: from her experiences with race and redlining to her discovery of color theory to her work as a visual artist. Journey with Williams to Chicago's South Side and explore ""Color(ed) Theory,"" a two-year art project in which she painted soon-to-be-demolished houses bold, monochromatic colors infused with local meaning -- catalyzing conversations and making the hidden visible.",0:13:22,13.36666667,322569,2019-03-19T14:40:47+00:00,"['art', 'beauty', 'race', 'creativity', 'identity', 'community', 'humanity', 'society']","['English', 'Español', 'Français', 'Italiano', 'Português brasileiro', 'Português de Portugal', 'Română', 'Tiếng Việt', 'Türkçe', 'Ελληνικά', 'Русский', 'العربية', '中文 (简体)', '中文 (繁體)', '日本語', '한국어']",Amanda Williams,Visual artist,unpopular
https://www.ted.com/talks/nick_pizzo_the_physics_of_surfing,The physics of surfing,"Whether or not you realize it, surfers are masters of complicated physics. The science of surfing begins as soon as a board first hits the water. Surfers may not be thinking about weather patterns in the Pacific, tectonic geology or fluid mechanics, but the art of catching the perfect wave relies on all these things and more. Nick Pizzo dives into the gnarly physics that make surfing possible. [Directed by Wonderlust, narrated by Addison Anderson, music by Wes Slover].",0:04:21,4.35,322186,2019-03-11T18:33:49+00:00,"['animation', 'TED-Ed', 'history', 'physics', 'water', 'oceans', 'geology']","['Bahasa Indonesia', 'English', 'Español', 'Français', 'Hrvatski', 'Polski', 'Português brasileiro', 'Português de Portugal', 'Tiếng Việt', 'Türkçe', 'Русский', 'Српски, Srpski', 'עברית', 'العربية', 'فارسى', '中文 (简体)', '中文 (繁體)', '日本語', '한국어']",Nick Pizzo,Educator,unpopular
https://www.ted.com/talks/reed_kroloff_a_tour_of_modern_architecture,A tour of modern architecture,"Reed Kroloff gives us a new lens for judging new architecture: is it modern, or is it romantic? Look for glorious images from two leading practices -- and a blistering critique of the 9/11 planning process.",0:15:10,15.16666667,320513,2008-07-28T06:36:00+00:00,"['architecture', 'art', 'business', 'design', 'humor']","['Deutsch', 'English', 'Español', 'Français', 'Italiano', 'Nederlands', 'Polski', 'Português brasileiro', 'Română', 'Tiếng Việt', 'Русский', 'български', 'עברית', 'العربية', 'فارسى', '中文 (简体)', '中文 (繁體)', '日本語', '한국어']",Reed Kroloff,Architecture critic,unpopular
