video_url,title,description,length,length_in_minutes,views,upload_date,related_tags,translations,speaker_name,speaker_profession,orig
https://www.ted.com/talks/lara_durgavich_an_evolutionary_perspective_on_human_health_and_disease,An evolutionary perspective on human health and disease,"How does your genetic inheritance, culture and history influence your health? Biological anthropologist Lara Durgavich discusses the field of evolutionary medicine as a gateway to understanding the quirks of human biology -- including why a genetic mutation can sometimes have beneficial effects -- and emphasizes how unraveling your own evolutionary past could glean insights into your current and future health.",0:15:20,15.33333333,1278645,2020-04-20T15:39:18+00:00,"['biology', 'evolution', 'medicine', 'science', 'history', 'TEDx', 'genetics', 'anthropology']","['Català', 'Deutsch', 'English', 'Español', 'Français', 'Magyar', 'Nederlands', 'Português brasileiro', 'Português de Portugal', 'Русский', 'עברית', 'العربية', '中文 (简体)', '中文 (繁體)']",Lara Durgavich,Biological anthropologist,middle
https://www.ted.com/talks/martha_minow_how_forgiveness_can_create_a_more_just_legal_system,How forgiveness can create a more just legal system,"Pardons, commutations and bankruptcy laws are all tools of forgiveness within the US legal system. Are we using them frequently enough, and with fairness? Law professor Martha Minow outlines how these merciful measures can reinforce racial and economic inequality -- and makes the case for creating a system of restorative justice that focuses on accountability and reconciliation rather than punishment.",0:14:35,14.58333333,1276029,2020-03-30T19:57:59+00:00,"['law', 'justice system', 'society', 'inequality', 'prison', 'community', 'United States', 'social change', 'crime', 'criminal justice']","['English', 'Español', 'Français', 'Magyar', 'Português brasileiro', 'Português de Portugal', 'Română', 'Türkçe', 'العربية', 'ภาษาไทย', '中文 (简体)', '中文 (繁體)']",Martha Minow,Human rights advocate,middle
https://www.ted.com/talks/esta_soler_how_we_turned_the_tide_on_domestic_violence_hint_the_polaroid_helped,How we turned the tide on domestic violence (Hint: the Polaroid helped),"When Esta Soler lobbied for a bill outlawing domestic violence in 1984, one politician called it the ""Take the Fun Out of Marriage Act."" ""If only I had Twitter then,"" she mused. In this sweeping, optimistic talk, Soler charts 30 years of tactics and technologies -- from the Polaroid camera to social media -- that led to a 64% drop in domestic violence in the U.S.",0:10:58,10.96666667,1249745,2014-02-03T16:00:41+00:00,"['gender', 'violence', 'women']","['Català', 'Deutsch', 'English', 'Español', 'Français', 'Italiano', 'Nederlands', 'Polski', 'Português brasileiro', 'Português de Portugal', 'Română', 'Shqip', 'Slovenščina', 'Svenska', 'Tiếng Việt', 'Türkçe', 'Čeština', 'Ελληνικά', 'Беларуская мова', 'Русский', 'Српски, Srpski', 'Українська', 'български', 'עברית', 'العربية', 'اُردُو', 'فارسى', '中文 (简体)', '中文 (繁體)', '日本語', '한국어']",Esta Soler,Violence and abuse prevention expert,middle
https://www.ted.com/talks/anthony_d_romero_this_is_what_democracy_looks_like,This is what democracy looks like,"In a quest to make sense of the political environment in the United States in 2017, lawyer and ACLU executive director Anthony D. Romero turned to a surprising place -- a 14th-century fresco by Italian Renaissance master Ambrogio Lorenzetti. What could a 700-year-old painting possibly teach us about life today? Turns out, a lot. Romero explains all in a talk that's as striking as the painting itself.",0:12:40,12.66666667,1248613,2017-05-24T14:51:03+00:00,"['activism', 'communication', 'democracy', 'global issues', 'government', 'future', 'immigration', 'history', 'inequality', 'peace', 'news', 'politics', 'refugees', 'social change', 'security', 'society', 'United States']","['Dansk', 'Deutsch', 'English', 'Español', 'Français', 'Italiano', 'Magyar', 'Nederlands', 'Português brasileiro', 'Português de Portugal', 'Tiếng Việt', 'Türkçe', 'Ελληνικά', 'Русский', 'Српски, Srpski', 'македонски', 'עברית', 'العربية', 'فارسى', '中文 (简体)', '中文 (繁體)', '日本語', '한국어']",Anthony D. Romero,"Executive Director, American Civil Liberties Union",middle
https://www.ted.com/talks/robert_muggah_the_biggest_risks_facing_cities_and_some_solutions,The biggest risks facing cities — and some solutions,"With fantastic new maps that show interactive, visual representations of urban fragility, Robert Muggah articulates an ancient but resurging idea: cities shouldn't just be the center of economics -- they should also be the foundation of our political lives. Looking around the world, from Syria to Singapore to Seoul and beyond, Muggah submits six principles for how we can build more resilient cities. ""Cities are where the future happens first. They're open, creative, dynamic, democratic, cosmopolitan, sexy,"" Muggah says. ""They're the perfect antidote to reactionary nationalism.""",0:17:02,17.03333333,1248184,2017-11-09T21:01:39+00:00,"['Brazil', 'climate change', 'data', 'democracy', 'economics', 'politics', 'future', 'map', 'global development', 'global issues', 'cities', 'government', 'infrastructure', 'society', 'inequality', 'urban planning']","['English', 'Español', 'Français', 'Magyar', 'Nederlands', 'Polski', 'Português brasileiro', 'Türkçe', 'Русский', 'العربية', '中文 (简体)', '中文 (繁體)', '한국어']",Robert Muggah,Megacities expert,middle
https://www.ted.com/talks/natsai_audrey_chieza_fashion_has_a_pollution_problem_can_biology_fix_it,Fashion has a pollution problem — can biology fix it?,"Natsai Audrey Chieza is a designer on a mission -- to reduce pollution in the fashion industry while creating amazing new things to wear. In her lab, she noticed that the bacteria Streptomyces coelicolor makes a striking red-purple pigment, and now she's using it to develop bold, color-fast fabric dye that cuts down on water waste and chemical runoff, compared with traditional dyes. And she isn't alone in using synthetic biology to redefine our material future; think -- ""leather"" made from mushrooms and superstrong yarn made from spider-silk protein. We're not going to build the future with fossil fuels, Chieza says. We're going to build it with biology.",0:13:06,13.1,1248102,2017-11-29T16:01:33+00:00,"['bacteria', 'creativity', 'biotech', 'design', 'biology', 'fashion', 'future', 'materials', 'innovation', 'nature', 'pollution', 'sustainability', 'science', 'technology', 'water']","['English', 'Español', 'Français', 'Hrvatski', 'Italiano', 'Magyar', 'Português brasileiro', 'Português de Portugal', 'Tiếng Việt', 'Türkçe', 'Русский', 'العربية', '中文 (简体)', '中文 (繁體)', '한국어']",Natsai Audrey Chieza,Designer,middle
https://www.ted.com/talks/christopher_bell_bring_on_the_female_superheroes,Bring on the female superheroes!,"Why is it so hard to find female superhero merchandise? In this passionate, sparkling talk, media studies scholar (and father of a Star Wars-obsessed daughter) Christopher Bell addresses the alarming lack of female superheroes in the toys and products marketed to kids -- and what it means for how we teach them about the world.",0:15:40,15.66666667,1248765,2016-08-30T15:00:57+00:00,"['art', 'children', 'communication', 'identity', 'entertainment', 'film', 'inequality', 'marketing', 'parenting', 'media', 'society', 'TEDx', 'women', 'toy', 'movies']","['Deutsch', 'English', 'Español', 'Français', 'Italiano', 'Magyar', 'Nederlands', 'Português brasileiro', 'Português de Portugal', 'Română', 'Tiếng Việt', 'Türkçe', 'Čeština', 'Русский', 'Српски, Srpski', 'Українська', 'עברית', 'العربية', 'فارسى', 'हिन्दी', 'ภาษาไทย', '中文 (简体)', '中文 (繁體)', '한국어']",Christopher Bell,Media studies scholar,middle
https://www.ted.com/talks/nancy_kanwisher_a_neural_portrait_of_the_human_mind,A neural portrait of the human mind,"Brain imaging pioneer Nancy Kanwisher, who uses fMRI scans to see activity in brain regions (often her own), shares what she and her colleagues have learned: The brain is made up of both highly specialized components and general-purpose ""machinery."" Another surprise: There's so much left to learn.",0:17:33,17.55,1246807,2014-10-02T01:01:00+00:00,"['brain', 'neuroscience', 'visualizations']","['Deutsch', 'English', 'Español', 'Français', 'Galego', 'Hrvatski', 'Italiano', 'Nederlands', 'Polski', 'Português brasileiro', 'Português de Portugal', 'Română', 'Shqip', 'Slovenčina', 'Svenska', 'Tiếng Việt', 'Türkçe', 'Русский', 'Српски, Srpski', 'Українська', 'עברית', 'العربية', 'فارسى', 'ภาษาไทย', '中文 (简体)', '中文 (繁體)', '日本語', '한국어']",Nancy Kanwisher,Brain researcher,middle
https://www.ted.com/talks/jeff_speck_the_walkable_city,The walkable city,"How do we solve the problem of the suburbs? Urbanist Jeff Speck shows how we can free ourselves from dependence on the car -- which he calls ""a gas-belching, time-wasting, life-threatening prosthetic device"" -- by making our cities more walkable and more pleasant for more people.",0:16:44,16.73333333,1246360,2013-10-14T15:19:17+00:00,"['cities', 'culture', 'design', 'transportation']","['Deutsch', 'English', 'Español', 'Français', 'Italiano', 'Latviešu', 'Magyar', 'Nederlands', 'Polski', 'Português brasileiro', 'Português de Portugal', 'Română', 'Tiếng Việt', 'Türkçe', 'Čeština', 'Ελληνικά', 'Русский', 'Українська', 'עברית', 'العربية', 'فارسى', 'ภาษาไทย', '中文 (简体)', '中文 (繁體)', '日本語', '한국어']",Jeff Speck,Urban planner,middle
https://www.ted.com/talks/kate_stafford_how_human_noise_affects_ocean_habitats,How human noise affects ocean habitats,"Oceanographer Kate Stafford lowers us into the sonically rich depths of the Arctic Ocean, where ice groans, whales sing to communicate over vast distances -- and climate change and human noise threaten to alter the environment in ways we don't understand. Learn more about why this underwater soundscape matters and what we might do to protect it.",0:11:43,11.71666667,1245224,2017-05-12T15:04:35+00:00,"['animals', 'Anthropocene', 'beauty', 'biodiversity', 'biology', 'biosphere', 'climate change', 'communication', 'environment', 'oceans', 'nature', 'science', 'Senses', 'TEDx', 'vocals', 'sound', 'water', 'Antarctica']","['Bahasa Indonesia', 'Deutsch', 'English', 'Español', 'Français', 'Italiano', 'Magyar', 'Nederlands', 'Polski', 'Português brasileiro', 'Português de Portugal', 'Română', 'Svenska', 'Tiếng Việt', 'Türkçe', 'Čeština', 'Русский', 'עברית', 'العربية', 'فارسى', '中文 (简体)', '中文 (繁體)', '日本語', '한국어']",Kate Stafford,Oceanographer,middle
https://www.ted.com/talks/alex_gendler_can_you_solve_the_dragon_jousting_riddle,Can you solve the dragon jousting riddle?,"After years of war, the world's kingdoms have come to an agreement. Every five years, teams representing the elves, goblins, and treefolk will compete in a grand tournament of dragon jousting. You have the important job of recording the scores for the inaugural tournament. But, you overslept and the games are already underway. Can you figure out the real score of each match? Alex Gendler shows how. [Directed by Artrake Studio, narrated by Addison Anderson].",0:04:24,4.4,1253728,2020-01-10T16:13:05+00:00,"['TED-Ed', 'animation', 'education', 'math']","['English', 'Español', 'Français', 'Italiano', 'Português brasileiro', 'Português de Portugal', 'Türkçe', 'Русский', 'עברית', 'العربية', 'کوردی', '中文 (简体)', '中文 (繁體)', '日本語']",Alex Gendler,Educator,middle
https://www.ted.com/talks/levon_biss_mind_blowing_magnified_portraits_of_insects,"Mind-blowing, magnified portraits of insects","Photographer Levon Biss was looking for a new, extraordinary subject when one afternoon he and his young son popped a ground beetle under a microscope and discovered the wondrous world of insects. Applying his knowledge of photography to subjects just five millimeters long, Biss created a process for shooting insects in unbelievable microscopic detail. He shares the resulting portraits -- each comprised of 8- to 10,000 individual shots -- and a story about how inspiration can come from the most unlikely places.",0:07:41,7.683333333,1244802,2017-10-04T14:48:56+00:00,"['art', 'animals', 'creativity', 'insects', 'photography']","['Deutsch', 'English', 'Español', 'Français', 'Italiano', 'Magyar', 'Polski', 'Português brasileiro', 'Português de Portugal', 'Română', 'Svenska', 'Tiếng Việt', 'Türkçe', 'Русский', 'Српски, Srpski', 'Українська', 'עברית', 'العربية', 'فارسى', 'မြန်မာဘာသာ', '中文 (简体)', '中文 (繁體)', '日本語', '한국어']",Levon Biss,Photographer,middle
https://www.ted.com/talks/theaster_gates_how_to_revive_a_neighborhood_with_imagination_beauty_and_art,"How to revive a neighborhood: with imagination, beauty and art","Theaster Gates, a potter by training and a social activist by calling, wanted to do something about the sorry state of his neighborhood on the south side of Chicago. So he did, transforming abandoned buildings to create community hubs that connect and inspire those who still live there (and draw in those who don't). In this passionate talk, Gates describes his efforts to build a ""miniature Versailles"" in Chicago, and he shares his fervent belief that culture can be a catalyst for social transformation in any city, anywhere.",0:16:45,16.75,1242698,2015-03-26T15:13:39+00:00,"['architecture', 'art', 'cities', 'design', 'environment', 'urban planning']","['English', 'Español', 'Français', 'Italiano', 'Nederlands', 'Polski', 'Português brasileiro', 'Português de Portugal', 'Română', 'Tiếng Việt', 'Türkçe', 'Ελληνικά', 'Русский', 'Српски, Srpski', 'Українська', 'עברית', 'العربية', 'فارسى', '中文 (简体)', '中文 (繁體)', '日本語', '한국어']",Theaster Gates,"Artist, potter, community builder",middle
https://www.ted.com/talks/nina_tandon_could_tissue_engineering_mean_personalized_medicine,Could tissue engineering mean personalized medicine?,"Each of our bodies is utterly unique, which is a lovely thought until it comes to treating an illness -- when every body reacts differently, often unpredictably, to standard treatment. Tissue engineer Nina Tandon talks about a possible solution: Using pluripotent stem cells to make personalized models of organs on which to test new drugs and treatments, and storing them on computer chips. (Call it extremely personalized medicine.)",0:06:04,6.066666667,1242241,2012-12-06T16:07:07+00:00,"['TED Fellows', 'biology', 'engineering', 'health care', 'medical research', 'medicine', 'science', 'technology', 'biotech', 'synthetic biology', 'health', 'pharmaceuticals', 'molecular biology', 'disease', 'physiology', 'illness', 'cancer', 'innovation']","['Bahasa Indonesia', 'Crnogorski', 'Dansk', 'Deutsch', 'English', 'Español', 'Français', 'Galego', 'Hrvatski', 'Italiano', 'Magyar', 'Nederlands', 'Polski', 'Português brasileiro', 'Português de Portugal', 'Română', 'Tiếng Việt', 'Türkçe', 'Ελληνικά', 'Русский', 'Српски, Srpski', 'Українська', 'български', 'עברית', 'العربية', 'فارسى', 'کوردی', 'हिन्दी', '中文 (简体)', '中文 (繁體)', '日本語', '한국어']",Nina Tandon,Tissue engineering researcher,middle
https://www.ted.com/talks/bill_gates_how_the_pandemic_will_shape_the_near_future,How the pandemic will shape the near future,"Bill Gates talks best (and worst) case scenarios for the coronavirus pandemic in the months ahead, explaining the challenges of reducing virus transmission, providing an update on promising vaccine candidates, offering his thoughts on reopening and even taking a moment to address conspiracy theories circulating about himself. Stay tuned for his critical call to fellow philanthropists to ramp up their action, ambition and awareness to create a better world for all. (This virtual conversation, hosted by head of TED Chris Anderson, was recorded June 29, 2020.)",0:42:59,42.98333333,1326314,2020-07-01T17:02:30+00:00,"['coronavirus', 'pandemic', 'science', 'public health', 'Vaccines', 'medical research', 'health', 'health care', 'disease', 'virus']","['English', 'Nederlands', 'Română', 'Türkçe', 'български', '中文 (繁體)']",Bill Gates,"Technologist, philanthropist",middle
https://www.ted.com/talks/ian_dunbar_dog_friendly_dog_training,Dog-friendly dog training,"Speaking at the 2007 EG conference, trainer Ian Dunbar asks us to see the world through the eyes of our beloved dogs. By knowing our pets' perspective, we can build their love and trust. It's a message that resonates well beyond the animal world.",0:14:27,14.45,1241267,2008-08-21T01:00:00+00:00,"['animals', 'brain', 'children', 'psychology', 'Best of the Web']","['Deutsch', 'English', 'Español', 'Français', 'Hrvatski', 'Italiano', 'Magyar', 'Nederlands', 'Polski', 'Português brasileiro', 'Português de Portugal', 'Română', 'Tiếng Việt', 'Türkçe', 'Ελληνικά', 'Русский', 'Српски, Srpski', 'български', 'македонски', 'עברית', 'العربية', '中文 (简体)', '中文 (繁體)', '日本語', '한국어']",Ian Dunbar,Animal behaviorist,middle
https://www.ted.com/talks/caroline_weaver_why_the_pencil_is_perfect,Why the pencil is perfect,"Why are pencils shaped like hexagons, and how did they get their iconic yellow color? Pencil shop owner Caroline Weaver takes us inside the fascinating history of the pencil.",0:03:31,3.516666667,1242666,2018-03-15T12:48:35+00:00,"['writing', 'design', 'history', 'industrial design']","['Deutsch', 'English', 'Español', 'Français', 'Italiano', 'Magyar', 'Nederlands', 'Polski', 'Português brasileiro', 'Română', 'Slovenčina', 'Tiếng Việt', 'Türkçe', 'Čeština', 'Ελληνικά', 'Русский', 'Српски, Srpski', 'Українська', 'български', 'Қазақ тілі', 'עברית', 'العربية', 'اُردُو', 'فارسى', 'کوردی', 'हिन्दी', 'ภาษาไทย', '中文 (简体)', '中文 (繁體)', '日本語', '한국어']",Caroline Weaver,"Author, pencil store owner",middle
https://www.ted.com/talks/john_lloyd_an_inventory_of_the_invisible,An inventory of the invisible,"Nature's mysteries meet tack-sharp wit in this hilarious, 10-minute mix of quips and fun lessons, as comedian, writer and TV man John Lloyd plucks at the substance of several things not seen.",0:10:10,10.16666667,1240578,2009-09-16T09:00:00+00:00,"['comedy', 'philosophy', 'science', 'humor']","['Azərbaycan dili', 'Català', 'Deutsch', 'English', 'Español', 'Esperanto', 'Français', 'Hrvatski', 'Italiano', 'Latviešu', 'Magyar', 'Nederlands', 'Polski', 'Português brasileiro', 'Português de Portugal', 'Română', 'Slovenščina', 'Tiếng Việt', 'Türkçe', 'Čeština', 'Ελληνικά', 'Русский', 'български', 'עברית', 'العربية', 'فارسى', '中文 (简体)', '中文 (繁體)', '日本語', '한국어']",John Lloyd,Producer,middle
https://www.ted.com/talks/annette_heuser_the_3_agencies_with_the_power_to_make_or_break_economies,The 3 agencies with the power to make or break economies,"The way we rate national economies is all wrong, says rating agency reformer Annette Heuser. With mysterious and obscure methods, three private US-based credit rating agencies wield immense power over national economies across the globe, and the outcomes can be catastrophic. But what if there was another way? In this bold talk, Heuser shares her vision for a nonprofit agency that would bring more equality and justice into the mix.",0:09:28,9.466666667,1240105,2014-02-28T15:44:28+00:00,"['business', 'finance', 'global issues']","['Deutsch', 'English', 'Español', 'Français', 'Galego', 'Hrvatski', 'Italiano', 'Magyar', 'Nederlands', 'Polski', 'Português brasileiro', 'Português de Portugal', 'Română', 'Shqip', 'Suomi', 'Tiếng Việt', 'Türkçe', 'Čeština', 'Ελληνικά', 'Русский', 'Українська', 'עברית', 'العربية', 'فارسى', 'ภาษาไทย', 'မြန်မာဘာသာ', '中文 (简体)', '中文 (繁體)', '日本語', '한국어']",Annette Heuser,Rating agency reformer,middle
https://www.ted.com/talks/anees_bahji_what_is_schizophrenia,What is schizophrenia?,"Schizophrenia was first identified more than a century ago, but we still don't know its exact causes. It remains one of the most misunderstood and stigmatized illnesses today. So what do we actually know about its symptoms, causes, and treatments? Anees Bahji investigates. [Directed by Artrake Studio, narrated by Susan Zimmerman, music by Stephen LaRosa].",0:05:07,5.116666667,1266896,2020-03-26T15:21:32+00:00,"['TED-Ed', 'education', 'animation', 'brain', 'human body', 'mental health', 'emotions', 'illness', 'disease', 'stigma', 'medicine']","['Bahasa Indonesia', 'Català', 'Deutsch', 'English', 'Español', 'Français', 'Hrvatski', 'Italiano', 'Polski', 'Português brasileiro', 'Português de Portugal', 'Română', 'Türkçe', 'Ελληνικά', 'Српски, Srpski', 'עברית', 'العربية', 'فارسى', 'کوردی', 'မြန်မာဘာသာ', '中文 (简体)', '中文 (繁體)', '日本語', '한국어']",Anees Bahji,Educator,middle
https://www.ted.com/talks/irina_kareva_math_can_help_uncover_cancer_s_secrets,Math can help uncover cancer's secrets,"Irina Kareva translates biology into mathematics and vice versa. She writes mathematical models that describe the dynamics of cancer, with the goal of developing new drugs that target tumors. ""The power and beauty of mathematical modeling lies in the fact that it makes you formalize, in a very rigorous way, what we think we know,"" Kareva says. ""It can help guide us to where we should keep looking, and where there may be a dead end."" It all comes down to asking the right question and translating it to the right equation, and back.",0:07:32,7.533333333,1239756,2018-04-03T14:58:35+00:00,"['biology', 'health', 'innovation', 'human body', 'medicine', 'science', 'math']","['Deutsch', 'English', 'Español', 'Français', 'Italiano', 'Magyar', 'Nederlands', 'Português brasileiro', 'Română', 'Türkçe', 'Ελληνικά', 'Русский', 'Українська', 'български', 'עברית', 'العربية', 'فارسى', 'ภาษาไทย', '中文 (简体)', '中文 (繁體)', '日本語', '한국어']",Irina Kareva,Theoretical biologist,middle
https://www.ted.com/talks/hubertus_knabe_the_dark_secrets_of_a_surveillance_state,The dark secrets of a surveillance state,"Tour the deep dark world of the East German state security agency known as Stasi. Uniquely powerful at spying on its citizens, until the fall of the Berlin Wall in 1989 the Stasi masterminded a system of surveillance and psychological pressure that kept the country under control for decades. Hubertus Knabe studies the Stasi — and was spied on by them. He shares stunning details from the fall of a surveillance state, and shows how easy it was for neighbor to turn on neighbor.",0:19:26,19.43333333,1239381,2014-08-06T15:02:35+00:00,"['Europe', 'government', 'history', 'intelligence', 'surveillance']","['Deutsch', 'English', 'Español', 'Français', 'Hrvatski', 'Italiano', 'Nederlands', 'Polski', 'Português brasileiro', 'Português de Portugal', 'Română', 'Slovenščina', 'Svenska', 'Tiếng Việt', 'Türkçe', 'Čeština', 'Ελληνικά', 'Русский', 'Српски, Srpski', 'Українська', 'עברית', 'العربية', 'فارسى', 'ภาษาไทย', '中文 (简体)', '中文 (繁體)', '日本語', '한국어']",Hubertus Knabe,Historian,middle
https://www.ted.com/talks/niti_bhan_the_hidden_opportunities_of_the_informal_economy,The hidden opportunities of the informal economy,"Niti Bhan studies business strategy for Africa's informal markets: the small shops and stands, skilled craftspeople and laborers who are the invisible engine that keeps the continent's economy running. It's tempting to think of these workers as tax-dodgers, even criminals -- but Bhan makes the case that this booming segment of the economy is legitimate and worthy of investment. ""These are the fertile seeds of businesses and enterprises,"" Bhan says. ""Can we start by recognizing these skills and occupations?""",0:07:18,7.3,1239265,2017-11-20T16:03:49+00:00,"['Africa', 'culture', 'creativity', 'business', 'economics', 'resources', 'investment', 'social change', 'society']","['English', 'Español', 'Français', 'Italiano', 'Kiswahili', 'Magyar', 'Português brasileiro', 'Português de Portugal', 'Tiếng Việt', 'Türkçe', 'Ελληνικά', 'Русский', 'Українська', 'العربية', 'မြန်မာဘာသာ', '中文 (简体)', '中文 (繁體)', '日本語', '한국어']",Niti Bhan,Human-centered strategist,middle
