video_url,title,description,length,length_in_minutes,views,upload_date,related_tags,translations,speaker_name,speaker_profession,full_transcript
https://www.ted.com/talks/enric_sala_por_que_necesitamos_proteger_el_alta_mar,Por qué necesitamos proteger el alta mar,"Estamos pescando más rápido que la capacidad de los peces de repoblar los mares, convirtiendo a nuestros océanos en zonas muertas. Pero el ecologista marino Enric Sala tiene un plan radical para salvar a los océanos y al mismo tiempo potenciar la industria pesquera. Él propone crear una reserva marina gigante que cubriría dos tercios de la superficie de los océanos y restauraría los beneficios ecológicos, económicos y sociales del mar.",00:12:44,12.733333333333333,11905,2018-06-06T21:27:52+00:00,"['environment', 'economics', 'biosphere', 'nature', 'oceans', 'fish', 'future', 'water', 'global commons', 'TED en Español']","['English', 'Español']",Enric Sala,Marine ecologist,"{'00:05': 'If you randomly jumped in any point of the sea today, surely you would see something like this. No big fishes, no fishes at all because we have fished them quicker than they reproduce.', '00:17': 'Today, I want to propose a strategy to save sea life and the idea has a lot to do with economics. In 1999, there was a little place called Cabo Pulmo in Baja California, in Mexico which was an underwater desert. Fishermen were frustrated by not having enough fishing. So, they decided to do something nobody expected. Instead of spending more time at sea searching for the last fish, they decided to stop fishing completely. They created a national park at sea, a marine reserve.', '00:51': ""When we came back to Cabo Pulmo ten years later, this is what we saw. What had been an underwater wasteland had become a kaleidoscope of color and life. We saw it come back to its pristine state in just ten years including the return of the biggest predators such as groupers, sharks, horse mackerel... Wow! It's an extraordinary place."", '01:19': 'If you scuba dive, go to Cabo Pulmo. Those visionary fishermen are now earning more money through tourism.', '01:27': ""When we can align economic needs with conservation miracles can happen. And we have seen similar recoveries throughout the world. I spent 20 years studying human impact on the sea. But seeing with my own eyes the regeneration of places like Cabo Pulmo gave me hope, so I decided, ten years ago, to abandon my position as a university professor to dedicate my life to protecting more places at sea, like these. In the past ten years our National Geographic, Pristine Seas team have been exploring, studying, documenting the wildest places at sea and working with government to protect them. All these places are already protected, and they cover a total surface of the size of half Canada. These places are the Yellowstones and the Serengetis of the sea. They are places where you jump into the water and immediately are surrounded by sharks. And that's good, it's good! Because sharks are a sign of a healthy ecosystem. These places are time machines that show us the sea from 500 years ago, from 1,000 years ago. But they also show us how the sea of the future could be. Because the sea has an extraordinary regenerative capacity. We have seen incredible recoveries in just a few years. What we have to do is protect more endangered places so they can be wild and full of life again."", '03:01': 'So, the question is: ""Is there any way of accelerating sea protection?"" Because today just the 2 percent of the sea is protected and that\'s not enough. Studies suggest that we need to protect at least 30 percent of the sea, not just to save sea life, but ourselves, too. Because the sea gives us food, and it gives us over the half of the oxygen we breathe. It absorbs much of the carbon pollution we release into the atmosphere. We need a healthy sea to survive.', '03:33': ""So, is there a way to accelerate protecting the sea? I think there is. And one of the solutions involves looking at international waters. Coastal countries have the authority over 200 nautical miles from the coast. Everything beyond that is called international waters or the high seas, too, shown in dark blue on this map. It's two-thirds of the ocean. No country is in charge of the high seas, but everyone is. Since it's a bit like the wild west, a lot of stuff happens there, and nobody controls anything."", '04:05': 'There are two kinds of fishing, mainly, at the high seas: at the bottom and at the surface. Bottom trawling is the most destructive practice on the planet. Supertrawlers, the biggest ships on the sea, have nets so large they can hold a dozen 747 planes. Those huge nets destroy everything in their path including deep-sea coral, which lives in submarine mountains and can be thousands of years old. Surface fishing focuses mostly on species that migrate from the high seas to the coastal waters, to the water of countries, such as tunas and sharks. Many of those are endangered species because they have been fished too much.', '04:48': ""But who fishes them? Who fishes at the high seas? Until now, it was difficult to know it exactly. Countries have not been transparent concerning long-distance fishing. Today, however, satellite technology allows us to track ships individually. And this is a revolution. This is the first time we are presenting the data you're about to see. I'm going to show you the routes of two ships fishing throughout a year using an automatic satellite positioning system. This is a ship fishing tunas and sharks for months around the south coast of the African continent. A few months later, the ship goes to Japan to replenish supplies and a while after, it's fishing around Madagascar. This other ship is a Russian trawler that fishes cod in Russian waters and also in international waters in the North Atlantic. Thanks to Global Fishing Watch we have been able to track more than 3,600 ships from more than 20 countries that were fishing at the high seas. Global Fishing Watch uses satellite positioning and artificial intelligence to automatically detect whether a ship is fishing or navigating. Depending on the kind of moves, we also know what kind of fishing it is."", '06:10': ""So, along with a group of international colleagues, scientists and economists, we decided to investigate who is fishing at the high seas and who benefits from it. My colleague Juan Mayorga from the University of California in Santa Barbara has produced detailed maps of fishing effort. Effort means how much time and fuel it takes to fish in each point of the sea. We have maps for each country that fishes in the high seas: China, Taiwan, Japan, Korea and Spain represent almost 80 percent of the fishing effort in the high seas. When we join all the countries, this is what we get: the global map of fishing effort. We know the identity of each ship on the database -- that's how we know the length of the ship, the tonnage, the engine power, how many crew members are on board... With this, we can calculate the staff cost, the fuel cost, etc. This is why, for the first time, we were able to calculate the costs of fishing on the high seas. The darker the red, the higher the cost."", '07:14': 'Colleagues from the University of British Columbia have illustrated how much each country is fishing. We also know the price of the fish when it leaves the ship. Combined with the effort data, we have been able to calculate, also for the first time, the profit, the income from fishing on the high seas. We have cost and we have income, thus, for the first time, too, we were able to calculate the profitability of fishing on the high seas, the net economic profit.', '07:46': ""I'm going to show you another map. The red color means that we are losing money by fishing in that area of the ocean. The blue color means that fishing is profitable there. There it is. It seems pretty profitable, right? But there are two important factors that we have to take into account. The first is: recent researches have revealed the use of forced labor or modern slavery on the high seas. Companies use modern slavery to reduce cost and get more profit. Secondly: each year, governments subsidize fishing on the high seas with over 4000 million dollars."", '08:28': ""Let's go back to the profits map. If we pretend that there is no slavery, that people are paid minimum wage, and deduct the government subsidies from our calculation, the map becomes this. Half of fishing on the high seas is not profitable. In fact, subsidies are four times bigger than the benefits. What this economic analysis reveals is that, practically, the entirety of fishing on the high seas makes no sense. What country, what government in its right mind would subsidize and support an industry cling to exploitation and fundamentally destructive? And it's not that profitable either."", '09:18': ""So... Why don't we close all international waters to fishing? Let's create a gigantic marine reserve on the high seas. Two thirds of the global ocean. Studies from the University of California suggest that such reserve would help the species in the high seas that migrate, such as tuna, and part of that growth in abundance would help to repopulate the coastal waters of the countries and the catch of those species would also rise, as well as the benefits, because the cost of fishing would decrease and the fish that large countries are now fishing in the wild west would be fished by the coastal countries. And well, the ecological benefits would be huge: to provide a refuge of two-thirds of the ocean for species of predators, such as tunas and sharks, which are essential to the health of the ecosystem."", '10:14': ""So, protecting the high seas, the international waters, would have ecological, economic and social benefits. But, the truth is that most fishing companies don't care about the environment. They would earn more money if they didn't fish on the high seas. Moreover, this would not affect our ability to feed our growing population, because fishing on the high seas represents only 5 percent of global marine catch since the high seas are not as productive as the coastal waters. And the high seas catch is sold as high-standing products, such as the tuna sashimi and shark fin soup. The high seas catch does not contribute to global food security."", '11:11': 'So, how are we going to do this? How are we going to protect the international waters? Right now, negotiators in the United Nations are starting discussions for a new treaty for the conservation in international waters. But this should not happen at closed doors. This is our big opportunity, and we all must ensure that our countries will support the conservation of international waters. There is a precedent. In 2016, 24 countries and the European Union agreed to protect the Ross Sea, the wildest place in the waters surrounding Antarctica, full of wildlife such as orcas, leopard seals, penguins, and those included fishing countries like China, Russia, Spain and Japan, but they decided that protecting that unique place was more beneficial than exploiting it for little profit. That is exactly the kind of international cooperation we will need. We can do it again.', '12:17': 'If in 20 years our children randomly jumped in any place of the sea, what would they see? An underwater desert, like most of our ocean today, or an abundance of life? Our legacy for the future.', '12:35': '(Applause)', '12:38': 'Thank you.', '12:39': '(Applause)'}"
https://www.ted.com/talks/mother_london_ai_therapy,"""AI therapy""","After 100 years of progress, AI bots have finally become too human for their own good. (Credits: Directors: Emerald Fennell & Chris Vernon; Director of Photography: Ben Kracun; Production Design: Jessica Sutton; VFX: Coffee & TV; Executive Producer, TED2018 Film Program: Sinéad McDevitt; Director of Production and Video Operations, TED: Mina Sabet)",,,11750,2018-04-14T19:49:53+00:00,"['AI', 'film', 'robots']",,Mother London,,{}
https://www.ted.com/talks/margaret_morris_the_new_sharing_of_emotions,The new sharing of emotions,"Can a smartphone add a new dimension to fostering mental health? Margaret Morris reveals how subjects successfully interacted with their phones throughout the day -- mapping moods, charting physical responses and getting instant ideas on confronting situations -- and rather than expressing concerns about privacy, they wanted to share their emotions with others.",,,11727,2018-07-30T21:08:52+00:00,"['emotions', 'technology', 'mental health']",,Margaret Morris,Clinical psychologist,{}
https://www.ted.com/talks/kevin_bethune_the_4_superpowers_of_design,The 4 superpowers of design,"Design veteran Kevin Bethune argues that designers' talents are often undervalued in business. He says that all designers have four key superpowers: x-ray vision, shapeshifting, extrasensory perception (ESP) and the ability to make others superhuman. Sound unbelievable? Watch and learn what can happen when designers are given space in the workplace to thrive and grow.",,,11728,2017-12-01T19:14:07+00:00,"['product design', 'design', 'interface design', 'work', 'business', 'collaboration', 'creativity', 'leadership']",,Kevin Bethune,Design champion,{}
https://www.ted.com/talks/kareem_yusuf_the_importance_of_emotional_tone_in_the_digital_age,The importance of emotional tone in the digital age,"Technology can be dehumanizing. Even our day-to-day personal interactions conducted in digital bursts risk losing the heart of who are. Kareem Yusuf shows how people have aimed to embed emotional ""tone"" into their digital lives, from text-messages to data. He explores why, in today's fully digitized and globalized world, we must strive to incorporate tone into everything we do.",,,11689,2018-02-12T15:24:40+00:00,"['technology', 'communication', 'society']",,Kareem Yusuf,Tone-setter,{}
https://www.ted.com/talks/keith_weed_the_power_of_transformative_collaboration,The power of transformative collaboration,"Climate change is a global issue and action must come from every aspect of society to yield the needed change. How can corporations make a difference without losing profit? Keith Weed argues that sustainability and economic growth can go hand-in-hand, after implementing a few key approaches.",,,11533,2018-07-30T21:25:01+00:00,"['economics', 'sustainability', 'climate change']",,Keith Weed,International collaborator,{}
https://www.ted.com/talks/michael_arntfield_how_you_can_help_solve_cold_cases,How you can help solve cold cases,"In his former life as a police officer, Michael Arntfield spent sleepless nights thinking about the increasing numbers of unsolved murders that ended up in oft-ignored cold case files. In this talk, he describes how that personal crisis prompted him to create one of the most unique citizen-driven clubs in the world, leveraging the skills of regular people to solve some of the most challenging cold cases in North America.",,,11509,2019-05-10T14:32:39+00:00,"['law', 'criminal justice', 'humanity', 'Social Science', 'collaboration']",,Michael Arntfield,"Criminologist, researcher",{}
https://www.ted.com/talks/timothy_graf_we_don_t_need_immigration_caps_we_need_minimums,We don't need immigration caps. We need minimums,"Timothy Graf's experiences moving from America to England sparked some fresh ideas about immigration. Our exacting border policies often ignore the significant benefits delivered by the new perspectives of immigrants, fresh ideas that are vital for future success. He argues that smart countries should be lowering roadblocks and setting both caps and minimums when it comes to immigration.",,,11498,2018-07-30T20:43:44+00:00,"['immigration', 'success', 'policy']",,Timothy Graf,Behavorial finance analyst,{}
https://www.ted.com/talks/graham_worthy_the_future_of_our_coastal_systems,The future of our coastal systems,"The US state of Florida is facing down environmental threats that affect millions of people a year, such as toxic algal blooms and hurricanes. The solutions will take Biologist (and Florida resident) Graham Worthy proposes that by breaking down academic silos and engaging interdisciplinary teams, Florida might finally start solving some of its interconnected ecological problems.",,,11491,2019-02-15T23:04:43+00:00,"['science', 'environment', 'communication', 'collaboration', 'education']",,Graham Worthy,,{}
https://www.ted.com/talks/rana_novack_how_we_ll_predict_the_next_refugee_crisis,How we'll predict the next refugee crisis,"""When it comes to refugees, we're improvising,"" Rana Novack says. The daughter of Syrian immigrants, Rana believes that if we applied predictive analytics, government agencies and humanitarian aid organizations would be better equipped to manage future crises. Using this technology, Rana developed a prototype that will be deployed with a refugee organization in Denmark. ""We have to make sure that the people who want to do the right thing, who want to help, have the tools and the information they need to succeed,"" she says, ""and those who don't act can no longer hide behind the excuse they didn't know it was coming.""",,,11329,2018-02-12T17:56:04+00:00,"['refugees', 'data', 'technology', 'immigration']",,Rana Novack,Refugee advocate,{}
https://www.ted.com/talks/stephen_trzeciak_want_a_happier_life_be_more_compassionate_jan_2018,Want a happier life? Be more compassionate,"Stephen Trzeciak was at the top of his game as a research scientist until an unexpected question from his 12-year-old son transformed his life's work. ""What is the most pressing problem of our time...do we really know? And what would happen if we actually did?"" In this talk, Trzeciak discusses the erosion of compassion in healthcare and how we can integrate his ""compassionomics"" methodology into our everyday lives to increase happiness and fulfillment.",,,11305,2018-05-22T17:38:38+00:00,"['Social Science', 'science', 'health', 'health care', 'compassion', 'happiness']",,Stephan Trzeciak,,{}
https://www.ted.com/talks/shane_griffin_chromatic,"""Chromatic""","As light passes through defective glass, beams split into color spectra, causing ""diffraction grating."" For the first time ever in film, we get up close and personal with this visual phenomenon in a series of beautiful chromatic abstractions. (Credits: Music: Gavin Little; Special thanks to: Ed Bruce at Screenscene, Los York; Executive Producer, TED2018 Film Program: Sinéad McDevitt; Director of Production and Video Operations, TED: Mina Sabet)",,,11172,2018-04-14T19:45:10+00:00,"['film', 'visualizations']",,Shane Griffin,Filmmaker,{}
https://www.ted.com/talks/shade_zahrai_and_aric_yegudkin_the_rhythmic_beauty_of_collaboration,The rhythmic beauty of collaboration,"This partner dance is ""a beautiful expression of unity"" that celebrates ""diversity through collaboration,"" offers Shadé Zahrai (accompanied onstage by Aric Yegudkin). Zahrai suggests that we are all dancers on the stage of life, with a part to play in building our collective future.",,,11136,2018-02-15T20:12:27+00:00,"['dance', 'collaboration', 'performance']",,Shadé Zahrai,Dancer,{}
